id,alt_store_name_catch,address_full,address_state,store_phone,store_email,business_hours_openi,business_hours_closi,averageRating,totalReviews,pincode
818,Shivam Road,"H No 2/2/647/3/A/3, Ground Floor, Shivam Road, Amberpet, Aphb Colony, New Nallakunta, Near Pizza Hut, Hyderabad, Telangana, 500044",Telangana,4048551461,shivamroad.hyderabad@lenskartstore.com,11:00 AM,09:30 PM,4.9,1870,500044
1075,Flagship Store Shamsahbad,"23/65/1, Madhura Nagar, Shamsahabad, Rangareddy, Hyderabad, Telangana, 501218",Telangana,8977002863,Shamshabad.hyderabad@lenskartstore.com,11:00 AM,09:30 PM,4.9,928,501218
53,Madhapur,"H No 1-90/20/G/1, Sai Siddartha Complex, Metro Pillar No 1760, Main Road, Madhapur, Metro Pillar No 1760, Hyderabad, Telangana, 500081",Telangana,9573214604,madhapur.hyderabad@lenskart.mobi,11:00 AM,09:30 PM,4.8,3623,500081
60,Himayat Nagar,"Shop No 3, 6/564/5 To 8, Circle, Himayat Nagar, Ap State Housing Board, Himayat Nagar, Near Mc Donald Brand Factory, Hyderabad, Telangana, 500029",Telangana,7093063663,himayatnagar.hyderabad@lenskart.mobi,11:00 AM,09:30 PM,4.8,1761,500029
63,Sanjeeva Reddy Nagar,"262/3Rt, Ground Floor, Mn Reddy Classic, Sr Nagar, Sanjeeva Reddy Nagar, Opposite Himalaya Book World, Hyderabad, Telangana, 500038",Telangana,9110784132,Srnagar.Hyderabad@lenskart.mobi,11:00 AM,09:30 PM,4.9,3948,500038
838,BN Reddy Nagar,"Ground Floor, Shop No 1, Old Court Building, Nagarjun Sagar Road, Omkar Nagar, Beside Hp Petrol Pump & Old Court Building, Hyderabad, Telangana, 500070",Telangana,7386137809,bnreddy.hyderabad@lenskartstore.com,11:00 AM,09:30 PM,4.9,984,500070
1863,Ameenpur Main Road,"Plot No 3, Chanda nagar, Serilingampally Mandal, Ranagreddy dist, Ameenpur, Hyderabad, Telangana, 502032",Telangana,4049937616,Ameenpur.hyderabad@lenskartstore.com,11:00 AM,09:30 PM,4.9,440,502032
845,MG Road Secunderabad,"Pb 1549, M G Road, Kalasiguda, Secunderabad, Mg Road, Opposite Paradise Hotel, Hyderabad, Telangana, 500003",Telangana,4042417180,mgroad.hyderabad2021@lenskartstore.com,11:00 AM,09:30 PM,4.8,514,500003
2136,Gachibowli Service Road,"Ground Floor, Commercial Complex, Plot No 138 &139, Satyanarayana Arcade, Gachibowli, Hyderabad, Telangana, 500032",Telangana,4040124120,gachibowliservicerd.hyderabad@lenskartstore.COM,11:00 AM,09:00 PM,4.9,620,500032
100,Tolichowki,"8/1/305 & 306, Anand Silicon Chip, Shaikpet Road, Tolichowki, Near Passport Office, Hyderabad, Telangana, 500008",Telangana,7032824939,tolichowki.hyderabad@lenskart.mobi,11:00 AM,09:30 PM,4.7,849,500008
612,Banjara Hills 2,"D No 8-2-626/5, Shop No-G5A, Reliance Classic Building, Road No 1, Banjara Hills",Telangana,8977002832,Banjarahills.Hyderabad@lenskartstore.com,11:00 AM,09:30 PM,4.8,228,500034
613,Somajiguda,"6-3-927/A&B, Ground Floor, Shobhan Building, Somajiguda, Raj Bhavan Road, Hyderabad, Telangana, 500082",Telangana,9100555630,Somajiguda.Hyderabad@lenskartstore.com,11:00 AM,09:30 PM,4.6,426,500082
1381,New Safilguda,"D No 24-88/40/1, East Anand Bagh, Safilguda, Opposite Fortune Honda Showroom, Hyderabad, Telangana, 500047",Telangana,8123631734,Safilgudanew.hyderabad@lenskartstore.com,11:00 AM,09:30 PM,4.9,1882,500047
359,Malkajgiri,"Shop No 3/238, Maruthi Nagar, Malkajgiri, Hyderabad, Telangana, 500047",Telangana,8792211315,malkajgiri.hyderabad@lenskartstore.com,11:00 AM,09:30 PM,4.8,2002,500047
360,Attapur,"Shop No 4/3/164, Ring Road, Attapur, Opposite Pillar No 138, Hyderabad, Telangana, 500048",Telangana,9100555628,attapur.hyderabad@lenskartstore.com,11:00 AM,09:30 PM,4.3,582,500048
1132,Gudimalkapur,"Shop No 13-6-439/1/A/111/7, Balaji Nagar, Mehdipatnam Ring Road, Gudimalkapur, Near Pillar No 75, Hyderabad, Telangana, 500006",Telangana,8977002861,gudimalkapur.hyderabad@lenskartstore.com,11:00 AM,09:30 PM,4.7,289,500006
367,Sarath City Capital Mall,"Shop No 99, Ground Floor, Kondapur, Sarath City Capital Mall, Opposite Vision Express, Hyderabad, Telangana, 500032",Telangana,9951234424,saratcitymall.hyderabad@lenskartstore.com,11:00 AM,09:30 PM,4.5,723,500032
623,Pragati Nagar,"Ground Floor, Gev Tulasi Building 132, Pragati Nagar Main Road, Pragati Nagar, Hyderabad, Telangana, 500090",Telangana,8522888204,Pragatinagar1.Hyderabad@lenskartstore.com,11:00 AM,09:30 PM,4.5,451,500090
1905,Habsiguda,"House No 1-65A/8, On Plot No 7, New No 1-4-53/1, Street No 8, Habsiguda, Hyderabad, Telangana, 500007",Telangana,9154148055,Habsiguda.hyderabad@lenskartstore.com,11:00 AM,09:00 PM,4.9,636,500007
626,Financial District,"S No-142, Sri Sai Gayatri Towerss, Financial District, Nanakramgudaa, Financial District, Hyderabad, Telangana, 500032",Telangana,8197529586,financialdist.hyderabad@lenskartstore.com,11:00 AM,09:30 PM,4.8,1039,500032
1651,Kaveri Hills Madhapur,"Plot No 27 & 28, Guttala Begumpet Village, Kavujri Hills, Phase 1, Seringampally Revenue Mandal, Rangareddy Dist, Hyderabad, Telangana, 500081",Telangana,4048595904,Madhapur1.hyderabad@lenskartstore.com,11:00 AM,09:30 PM,4.9,613,500081
884,Patancheruvu,"H No 25 & 35/4, On Plot No 1 & 2 In Survey No.167, Ramachandrapuram, Patancheruvu, Beside Icici Bank, Hyderabad, Telangana, 502032",Telangana,4040189174,patancheruvu.hyderabad@lenskartstore.com,11:00 AM,09:30 PM,4.9,2918,502032
120,Uppal Depot,"Shop No 2, House No 9/14/2/1, Main Road, Sriram Nagar Colony, Opposite Eden Garden Church, Hyderabad, Telangana, 500092",Telangana,9515530459,boduppal.hyderabad@lenskart.mobi,11:00 AM,09:00 PM,4.7,626,500092
121,Vanasthalipuram,"House No 6/4/3 MIG, LOT Building, Plot No 35, Vanasthalipuram Police Station Road, Opposite Indian Post Office, Hyderabad, Telangana 500070",Telangana,7993146026,vanasthalipuram.hoid@lenskart.mobi,11:00 AM,09:00 PM,4.7,1269,500070
1145,Old Bowenpally,"Mlr Towers Sy No 110, Plot No 2, & No 6-R6-60, Centre Point, New Bowenpally, Hyderabad, Telangana, 500011",Telangana,8522888202,bowenpally.hyderabad@lenskartstore.com,11:00 AM,09:30 PM,4.9,1477,500011
1403,Suncity,"Ground Floor, House No 7-17/6, Suncity Main Road, Suncity, Opposite Lucid Medical Diagnostics, Hyderabad, Telangana, 500091",Telangana,8977002872,Suncity.hyderabad@lenskartstore.com,11:00 AM,09:30 PM,4.1,245,500091
1915,Boduppal,"Shop No 1-1/2, Plot No 96, Survey No, 145,146 & 147, Village Boduppal, Ghatkesar, Mandal, Main Road, West Hanuman Nagar, Uppal, Rangareddy, Hyderabad, 500092",Hyderabad,9154148056,boduppal2.hyderabad@lenskartstore.com,10:00 AM,09:30 PM,4.8,469,500092
2172,Tirumalagiri,"Sy 26, Tirumalagiri, Secunderabad, Beside Mahindra Show Room, Hyderabad, Telangana, 500015",Telangana,4049954026,Tirumalagiri.hyderabad@lenskartstore.com,11:00 AM,09:30 PM,4.9,129,500015
639,Diamond Hills,"2-1/6&2-1/6A, Ground Floor, Fantasy Square, Diamond Hills, Serlingampally, Gachibowli, Hyderabad, Telangana, 500081",Telangana,7675840501,hyd.diamondhills@lenskartstore.com,11:00 AM,09:30 PM,4.9,1563,500081
896,"SD Road, Secunderabad","H No 9-1-122 & 123/1, Sd Road, Scunderabad, Sd Road, Scunderabad, Beside Dcb Bank, Hyderabad, Telangana, 500003",Telangana,4049944206,sdroad.hyderabad@lenskartstore.com,11:00 AM,09:30 PM,4.8,350,500003
1154,Punjagutta,"House No 6-3-696, G2, Ground Floor, Punjagutta Main Road, Panjagutta, Metro Pillar Number A 1103, Hyderabad, Telangana, 500029",Telangana,8977002839,panjagutta.hyderabad@lenskartstore.com,11:00 AM,09:30 PM,4.8,295,500029
1155,Mallapur,"House No 3-498/1/1/3, Ground Floor, Plot No 3, Situated Mallapur Village, Uppal Mandal, Kapra Circle, Mallapur, Hyderabad, Telangana, 500076",Telangana,9154148050,Mallapur.hyderabad@lenskartstore.com,11:00 AM,09:30 PM,4.9,395,500076
2181,Yousufguda,"House No 8-3-231/4/7, Lakshmi Plaza, Metro Piller #C1549, Opposite HDFC Bank, Sri Krishna Nagar, Yousufguda, Hyderabad, Telangana, 500045",Telangana,8951803554,Yousufguda.hyderabad1@lenskartstore.com,10:30 AM,09:30 PM,4.8,122,500045
2182,Kokapet,"Plot No 2 & 3, Brundavan Colony, Gandipet Main Road, Narsingi, Kokapet, Hyderabad, Telangana, 500075",Telangana,7674929167,kokapet.hyderabad@lenskartstore.com,11:00 AM,10:00 PM,4.9,222,500075
905,Nacharam,"Emr Complex No 4-1-91/6, Bhavani Nagar, Nacharam Main Road, Nacharam, Nacharam, Hyderabad, Telangana, 500076",Telangana,4041923116,nacharamNacharam.hyderabad@lenskartstore.com,11:00 AM,09:30 PM,4.8,873,500076
907,Kushaiguda,"Plot Bearing No 2/A, Survey No 215, 216, 217, 218 And 222, Chakripuram, Kushaiguda, Under Kapra Municipality, Keesara Mandal, Ranga Reddy District, Hyderabad, Telangana, 500",Telangana,8123698355,kushaiguda.hyderabad@lenskartstore.com,11:00 AM,09:30 PM,4.9,1738,500062
908,Kothapet Nagole Road,"1-1-62/5 Shrungeri Colony, Mohan Nagar, Kothapet Nagole Road, Hyderabad, Telangana, 500035",Telangana,4042014386,nagole.hyderabad@lenskartstore.com,11:00 AM,09:30 PM,4.9,903,500035
401,Flagship Store at Gachibowli,"G2, Vaishnavi Tanmai Plaza, 10 Roads, Gachibowli, Near Hp Petrol Bunk, Opposite Rttc, Hyderabad, Telangana, 500032",Telangana,4049937613,gachibowli.hyderabad@lenskartstore.com,11:00 AM,09:30 PM,4.7,2193,500032
1169,Banjara Hills,"Ghmc 8-2- 681 & 681/1, Road No 12, Ghmc, Banjara Hills, Opposite Himalaya Book World, Hyderabad, Telangana, 500034",Telangana,4046032544,banjarahills.hyderabad@john-jacobs.com,11:00 AM,09:30 PM,4.9,177,500034
1430,New Kachiguda,"3-4-1081, Kachiguda Station Road, Barkatpura, Kachiguda, Near Kachiguda Signal, Hyderabad, Telangana, 500027",Telangana,9611027967,Kachigudanew.hyderabad@lenskartstore.com,11:00 AM,09:30 PM,4.9,1547,500027
407,Jubilee Hills,"Municipal No 8/2/293/82/A471, Road No 36, Jubilee Hills, Near Jubilee Police Station, Hyderabad, Telangana, 500033",Telangana,6302689163,jubileehills.hyderabad@lenskartstore.com,11:00 AM,09:30 PM,4.6,390,500033
1180,Narsingi,"Plot # 68A, Alkapur Road # 7, Puppal Guda, Opposite Celebrations Function Hall, Hyderabad, Telangana, 500089",Telangana,8121433972,narsingi.hyderabad@lenskartstore.com,11:00 AM,09:30 PM,4.9,948,500089
1699,Karmanghat,"House No.10-1-81/1/2A & 10-1-81/1/3, Plot No 9, In Survey No 22 Part, Situated At Raghavendra Nagar Colony, Lingojiguda Village, Saroornagar Revenue Mandal, Under GHMC L B Nagar Circle, Ranga Reddy Di",Telangana,9100289996,Kharmanghat.hyderabad@lenskartstore.com,11:00 AM,09:30 PM,4.9,1752,500079
932,Hydernagar,"Dno-16-2-M/14/G1, Ground Floor, Sai Plaza, Charma Reddy Colony, Phase II, Hydernagar Village, Opposite Rainbow Children'S Hospital, Kukatpally, Hyderabad, Telangana, 500085",Telangana,7842347590,hydernagar.hyderabad@lenskartstore.com,11:00 AM,09:30 PM,4.8,572,500085
1701,Malaysian Townshiop,"VI KPHB Colony, Malaysian Townshiop, Kukatpally Village & Mandal, Under GHMC Kukatpally Circle, Medchal Malkajgiri, Ranga Reddy District, Hyderabad, Telangana, 500085",Telangana,8522888292,malaysiantownship.hyderabad@lenskartstore.com,11:00 AM,09:30 PM,4.8,410,500085
2213,HMT Hills Pragathinagar,"Flat No G, 2, Pragathi Nagar Road, Addagutta Society, HMT Hills, Beside Eenadu Bank, Jal Vayu Vihar, Kukatpally, Hyderabad, Telangana, 500085",Telangana,4049987106,Hmthills.hyderabad@lenskartstore.com,10:30 AM,09:30 PM,5.0,64,500085
1198,Quthbullapur,"Plot No 6, Ground Floor, Ganesh Housing Colony, Suchitra X Roads, Quthbullapur, Hyderabad, Telangana, 500067",Telangana,4049937630,quthbullapur.hyderabad1@lenskartstore.com,11:00 AM,09:30 PM,4.9,1532,500067
1454,Gaddiannaram,"16-2-754/A/1/A, Asmangad Malakpet 6 Circle, Gaddiannaram, Beside Rajesh Dental Specialities, Hyderabad, Telangana, 500036",Telangana,9154148051,Gaddiannarammainroad.hyderabad@lenskartstore.com,11:00 AM,09:30 PM,4.9,1249,500036
1456,Allwyn Colony,"Ground Floor, House No 2-22-88/2/A, Allwyn Colony, Situated Vijayanagar Colony, Enadu Society, Kukatpally, Near Patel Kunta Huda Park, Hyderabad, Telangana, 500072",Telangana,8522888902,Allwyncolony.hyderabad@lenskartstore.com,11:00 AM,09:30 PM,4.9,562,500072
1202,New Friends Colony,"13-6-798/1/21, New Friends Colony, Langar Houz, New Friends Colony, Beside Bapughat, Hyderabad, Telangana, 500008",Telangana,8977002871,Newfriendscolony.hyderabad@lenskartstore.com,11:00 AM,09:30 PM,4.8,346,500008
947,Hyderguda,"Ground Floor, Baba Towers, Tilak Road, King Koti, Hyderguda, Beside Bakezone, Hyderabad, Telangana, 500048",Telangana,8123692776,hyderguda.hyderabad@lenskartstore.com,11:00 AM,09:30 PM,4.9,1837,500048
1221,Kapra,"House No 3-30/1, Plot No1, Sri Nagar Colony, Kapra Village & Mandal, Medchal District, Kapra, Hyderabad, Telangana, 500062",Telangana,8105267832,Kapra.hyderabad@lenskartstore.com,11:00 AM,09:30 PM,4.9,1323,500062
711,Dilsukh Nagar,"16-11-741/C/13/5, Ground Floor, Vijetha Royal Empire, Indira Nagar, Dilsukh Nagar, Opposite Ram Raj Cotton, Hyderabad, Telangana, 500036",Telangana,9154148054,dilsukhnagar.hyderabad@lenskartstore.com,11:00 AM,10:00 PM,4.7,557,500036
968,Vivekananda Nagar,"House No 3-6-23/4, Plot No 297, Survey Numbers 137&139, Bagh Ameeri Village, Balanagar Madal, Kukatpally Cricle Ghmc, Ranga Reddy, Vivekananda Nagar, Beside Partha Dental Clinic, Hyderabad, Telangana,",Telangana,8522888203,vivekanandanagar.hyderabad@lenskartstore.com,11:00 AM,09:30 PM,4.8,640,500018
969,Alwal,"171 12, Nr Temple, Alwal Village, Ghmc, Alwal Circle, Malkajgiri Mandal, Ranga Reddy, Alwal, Beside Partha Dental Clinic, Hyderabad, Telangana, 500010",Telangana,4040191393,Alwal.hyderabad@lenskartstore.com,11:00 AM,09:30 PM,4.9,3367,500010
458,Manikonda,"House No 8-1-284/Ou/20, Ground Floor, Ou Colony, Shaikpet, Manikonda, Near Naturals Saloon, Hyderabad, Telangana, 500008",Telangana,8413461717,manikonda.hyderabad@lenskartstore.com,11:00 AM,09:30 PM,4.6,748,500008
719,Nallagandla,"Ground Floor, Ghmc 7-7/205, Nallagandle, Near Reliance Digital, Nallagandle, Hyderabad, Telangana, 500019",Telangana,8121751320,nallaganadla.hyderabad@lenskartstore.com,11:00 AM,09:30 PM,4.3,828,500019
1743,Serilingampally,"Plot No3, Huda Trade Centre, Seri Nallagandla Village, Serilingampally Mandal And Municipality, Ranga Reddy District, Hyderabad, Telangana, 500019",Telangana,4042407184,Serilingamapally.hyderabad@lenskartstore.com,11:00 AM,09:30 PM,4.9,403,500019
468,Kukatpally 2,"Mig 161, Ground Floor, Road No 1, Kphb Colony, Kukatpally 2, Opposite Holistic Hospital, Hyderabad, Telangana, 500072",Telangana,4048530594,kphb2.hyderabad@lenskartstore.com,11:00 AM,09:30 PM,4.7,1004,500072
216,Banjara Hills,"Mch No 6/3/348/B/201A, Ground Floor, Bke Owners Society, Road 1, Banjara Hills, Opposite Vangal Rao Park, Hyderabad, Telangana, 500034",Telangana,9100555627,banjarahills.hyderabad@lenskartstore.com,11:00 AM,09:30 PM,4.4,251,500034
2008,Chanda Nagar,"Shop No 2/105, C F2/F3, United Chambers, Near The Chennai Shopping Mall, Sri Ram Nagar Colony, Chanda Nagar, Hyderabad, Telangana, 500050",Telangana,8790837692,chandanagar02.hyderabad@lenskartstore.com,10:30 AM,09:30 PM,4.5,425,500050
488,GSM Mall,"Shop No Ff 101, First Floor, Gsm Mall, Madinaguda, Miyapur, Opposite My Home Jewel Apartments, Hyderabad, Telangana, 500049",Telangana,4042865752,gsmmall.hyderabad@lenskartstore.com,11:00 AM,09:30 PM,4.9,603,500049
1512,Puppalguda Shaikpet,"Plot No 40 & 41, Shop No 4-3/40/41/S2/A/1, S S Tower, Friends Colony, Puppalguda, Hyderabad, Telangana, 500089",Telangana,8413467144,puppalguda.hyderabad@lenskartstore.com,11:00 AM,09:30 PM,4.9,590,500089
1002,Shantosh Nagar,"&#34, Khaja Estate, Shop No 2, Ground Floor, 17-1-376/3, Shantosh Nagar, Hyderabad, Telangana, 500059",Telangana,8121153085,santoshnagar.hyderabad@lenskartstore.com,11:00 AM,09:30 PM,4.9,1606,500059
748,Himayath Nagar,"Flat No 3-6-365, Y V Rao Mansion 104&105, Himayatnagar Road, Gagan Mahal, Hyderabad, Telangana, 500029",Telangana,7204260359,himayatnagar.hyderabad@lenskartstore.com,11:00 AM,09:30 PM,4.9,1778,500029
749,Botanical Garden,"H No 1-57/19, Sri Ram Nagar, Botanical Garden Road, Kondapur, Opposite Airtel Showroom, Hyderabad, Telangana, 500031",Telangana,9989701351,botanicalgardenroad.hyderabad@lenskartstore.com,11:00 AM,09:30 PM,4.8,1018,500031
755,Madeenaguda,"Shop No G2, Ground Floor, Kalyan Tulasi Ram Chambers, Madeenaguda, Opposite Croma & Allensolly, Hyderabad, Telangana, 500049",Telangana,7204423730,madinaguda.hyderabad@lenskartstore.com,11:00 AM,09:30 PM,4.9,1832,500049
1524,Ramanthapur,"House No 3-11-65 & 68, Gokhale Nagar, Ramanthapur, Beside Raghavendra Tifins Center & Pharma Hub, Hyderabad, Telangana, 500013",Telangana,9154148049,Ramanthapura.hyderabad@lenskartstore.com,11:00 AM,09:30 PM,4.9,738,500013
757,"Chanda Nagar, BHEL","2-88, National Highway 65, Gangaram, Chanda Nagar Bhel, Opposite Karachi Bakery, Hyderabad, Telangana, 500050",Telangana,8522888232,bhelchandanagar.hyderdabad@lenskartstore.com,11:00 AM,09:30 PM,4.9,1377,500050
1019,Uppal,"2 2 173, Ground Floor, Vijay Colony, Kv Rangreddy, Uppal, Near Gandhi Statue, Hyderabad, Telangana, 500039",Telangana,4040052684,uppal.hyderabad@lenskartstore.com,11:00 AM,09:30 PM,4.9,957,500039
1791,IDPL Chintal Main Road,"Ground Floor, House No 5 080, IDPL Chintal Main Road, Ranga Nagar Colony, Village Quthbullapur, Mandal, Quthbullapur, GHMC Gajularamaram Circle, Medchal Malkajgiri, Hyderabad, Telangana, 500055",Telangana,4040186949,Idplchintal.hyderabad@lenskartstore.com,11:00 AM,09:30 PM,4.9,929,500055
1047,Raghunath Bazaar,"Shop No 210, Main Market, Raghunath Bazaar, Jammu & Kashmir, 180001",Jammu and Kashmir,9906354319,raghunathbazar.jammu@lenskartstore.com,10:30 AM,09:00 PM,4.9,912,180001
1325,Kunjwani,"Ground Floor & First Floor, National Highway, Kunjwani, Opposite Petrol Pump, Jammu & Kashmir, 180010",Jammu and Kashmir,1914018868,kunjwaninew.jammu@lenskartstore.com,10:30 AM,09:00 PM,4.9,999,180010
1329,Channi,"Ground Floor, Khasra No 4Min, Khata No 18Min, Khewat No 1 Min, Channi, Situated At Mouza Channi Kamala, Jammu & Kashmir, 180015",Jammu and Kashmir,1914068610,channi.jammu@lenskartstore.com,10:30 AM,09:00 PM,4.9,879,180015
826,Janipur,"Shop No 4, Lane No 1, Disco Road Janipur, Near Octave Showroom, Jammu & Kashmir, 180007",Jammu and Kashmir,1914012543,Janipur.jammu@lenskartstore.com,11:00 AM,09:00 PM,4.9,1566,180007
1888,RS Pura Jammu,"Ground Floor, Khasra No 184 Min, Khata No 691, Khewat No 118, Gagian, RS Pura Jammu, Jammu and Kashmir, 181102",Jammu and Kashmir,9797650630,rspura.jammu@lenskartstore.com,10:00 AM,08:00 PM,4.9,228,181102
396,The Wave Mall,"Shop No 12, Upper Ground Floor, Malik Market, The Wave Mall, Opposite Bathindi Road, Jammu, Jammu & Kashmir, 181152",Jammu and Kashmir,1913534812,thewavemall.jammu@lenskartstore.com,10:30 AM,09:00 PM,4.9,1008,181152
1181,Talab Tillo,"Ground Floor, B2, Bharat Nagar, Talab Tillo, Jammu & Kashmir, 180002",Jammu and Kashmir,1914077303,talabtillo.jammu@lenskartstore.com,10:30 AM,09:00 PM,4.9,654,180002
1195,Udhampur,"Dhar Road, Adjoining Allahabad Bank, Udhampur, Below Oriental Bank Of Commerce, Jammu & Kashmir, 182101",Jammu and Kashmir,1992458863,udhampur.jammuandkashmir@lenskartstore.com,11:00 AM,09:00 PM,4.9,1050,182101
2247,Srinagar Residency,"Le Regal, Near Kohli Brothers, Regal Chowk, Residency Road, Srinagar, Jammu and Kashmir, 190001",Jammu and Kashmir,6005261620,residencyroad.srinagar@lenskartstore.com,10:30 AM,07:00 PM,4.8,21,190001
761,Gandhinagar,"Shop No 18, Gole Market, Gandhi Nagar, Near Manyavar Store, Jammu & Kashmir, 180004",Jammu and Kashmir,1913100097,gandhinagar.jammu@lenskartstore.com,11:00 AM,09:00 PM,4.9,1667,180004
1281,Adityapur,"Site No 1, Aditypur Colony, Tata Kandra Road, Adityapur, Jamshedpur, Jharkhand, 831013",Jharkhand,9142887979,adityapurroad.jamshedpur@lenskartstore.com,10:30 AM,08:30 PM,4.9,693,831013
1538,Ramgarh,"Plot No 172, Gram Thana Chawk, Ramghar Cantt Area, Near Gandhi Chawk, Ramgarh, Jharkhand, 829122",Jharkhand,9801573722,ramgarh02.jharkhand@lenskartstore.com,10:30 AM,08:30 PM,5.0,725,829122
515,Harmu Ranchi,"Ground Floor, Girdhar Plaza, Harmu Road, Girdhar Plaza, Ranchi, Jharkhand, 834001",Jharkhand,6514651117,Harmu.ranchi@lenskartstore.com,10:30 AM,08:30 PM,4.8,1428,834001
1543,Nilanchal Colony,"Khata No 5, Plot No 769, Nilanchal Colony, Chanakya Nagar, Saraidhela, Dhanbad, Jharkhand, 828127",Jharkhand,3263500792,steelgate.dhanbad@lenskartstore.com,10:30 AM,08:30 PM,4.9,843,828127
28,H B Road,"Global Enterprises, Ranjen'S Chandralaya, H B Road, Near Santevita Hospital, Opposite Seventh Heaven Restaurant, Ranchi, Jharkhand, 834001",Jharkhand,6513511207,lenskartranchi@gmail.com,10:30 AM,08:30 PM,4.6,664,834001
807,Bistupur,"3, Natraj Mansion, Bistupur Main Road, Bistupur, Jamshedpur, Jharkhand, 831001",Jharkhand,7061206339,bistupur.jamshedpur@lenskartstore.com,10:30 AM,08:30 PM,4.9,1652,831001
47,Sector 4 Bokaro,"City Centre, Sector 4, A11, Below Shane Punjab Restaurant, Sector 4 Bokaro, Opposite Central Bank Of India, Bokaro, Jharkhand, 827004",Jharkhand,6542233443,bokaro@lenskart.mobi,10:30 AM,08:30 PM,4.7,351,827004
2119,Dimna Road,"H No 364, Dimna Road, Mango, Jamshedpur, Near Micro Chemical Lab, Bahar Dari, East Singhbhum, Jamshedpur, Jharkhand, 831012",Jharkhand,7735726291,dimnaroad.jamshedpur@lenskartstore.com,10:30 AM,08:30 PM,5.0,258,831012
1611,Shyamganj,"Ground Floor, Savitri Complex, Railway Station Road, Near ICICI Bank, Shyamganj, Deoghar, Jharkhand, 814112",Jharkhand,8252629377,deoghar02.jharkhand@lenskartstore.com,10:30 AM,09:00 PM,4.9,556,814112
591,Bank More,"Ug 3, Upper Ground Floor, Urmila Tower, Bank More, Near Shanti Bhawan, Dhanbad, Jharkhand, 826001",Jharkhand,6287173999,troikaretailindia@gmail.com,10:30 AM,08:30 PM,4.8,1037,826001
1366,Bariatu,"Shop No 14 & 15, Malabar Enclave, Bariatu, Near D A V School, Ranchi, Jharkhand, 834009",Jharkhand,6514657011,bariatu.ranchi@lenskartstore.com,10:30 AM,08:30 PM,4.8,803,834009
1883,Azad Nagar Road No 1,"Shop No 1, Ground Floor, House No 1, Building Asfia Jamal, Gold PS Mango, Azad Nagar, Road No 01, Ward No 8, MNAC, Opposite Ghandhi Maidan, Jamshedpur, Jharkhand, 831012",Jharkhand,9142951704,puruliyard.jamshedpur@lenskartstore.com,10:30 AM,08:30 PM,4.9,461,831012
1907,Mall Of Ranchi,"Unit No 3, Mall Of Ranchi, Ratu Road, Ranchi, Jharkhand, 834001",Jharkhand,6127180727,mallofranchi.ranchi@lenskartstore.com,11:00 AM,09:00 PM,4.9,613,834001
640,Sackhi,"Holding No 16, New Kalimati Road, Sackhi, Jamshedpur, Jharkhand, 831001",Jharkhand,9113340129,sakchi.jamshedpur@lenskartstore.com,10:30 AM,08:30 PM,4.8,971,831001
1920,Bokaro Chas,"Plot No 7090, Mouza Chas, Pargana Chas, P S Chas, Thana No 30, Khaspel, Near Bypass Road, Ward No 16, Bokaro, Jharkhand, 827013",Jharkhand,8083141502,bokarochas.jharkhand@lenskartstore.com,10:30 AM,08:30 PM,5.0,624,827013
1178,"Main Road, Ranchi","Ground Floor, Capitol Hill Building, Main Road, Capitol Hill Building, Ranchi, Jharkhand, 834001",Jharkhand,6514651974,mainraod.ranchi@lenskartstore.com,10:30 AM,08:30 PM,4.8,555,834001
426,Nucleus Mall,"Shop No S5, Second Floor, Circular Road, Lalpur, Nucleus Mall, Ranchi, Jharkhand, 834001",Jharkhand,8987449015,nucleusmall.ranchi@lenskartstore.com,10:30 AM,08:30 PM,4.9,1709,834001
2232,CMPF Colony,"Police Line, Hirapur, CMPF Colony, Near HDFC Bank, Dhanbad, Jharkhand, 826001",Jharkhand,8197541834,dhanbad.hirapur@lenskartstore.com,10:30 AM,08:30 PM,4.9,250,826001
965,Kanke Road,"Shop No 9, Ground Floor, Chandni Chowk, Astor Green, Kanke Road, Chandni Chowk, Ranchi, Jharkhand, 834008",Jharkhand,6201829791,kankeroad.ranchi1@lenskartstore.com,10:30 AM,08:30 PM,4.8,620,834008
457,P&M Hi Tech City Center Mall,"Un F 04, Outer Circle Rd, Millenium Park, Bistupur, P & M Hi Tech City Center Mall, Jamshedpur, Jharkhand, 831001",Jharkhand,6572320294,pm.jamshedpur@lenskartstore.com,11:00 AM,09:00 PM,4.9,1287,831001
994,Hazaribagh,"Shop No 235, Guru Gobind Singh Road, Near Annada Chowk, Hazaribagh, Jharkhand, 825301",Jharkhand,9905114330,hazaribagh.jharkhand@lenskartstore.com,10:30 AM,08:30 PM,4.9,710,825301
996,Kadma,"Ground Floor, Narayan Complex, Kadma, Jamshedpur, Jharkhand, 831005",Jharkhand,6572918544,kadma.jamshedpur@lenskartstore.com,10:30 AM,08:30 PM,4.9,1459,831005
2280,Puruliya Road,"Puruliya Road, Dangratoli Chowk, Near Kashyap Eye Hospital, Dangratoli, NayaToli, Ranchi, Jharkhand, 834001",Jharkhand,6514651050,puruliyaroad1.ranchi@lenskartstore.com,10:30 AM,08:30 PM,5.0,96,834001
1024,NRI layout,"No 06, Double Road, Nri Layout, Ramamurthy Nagar, Bengaluru, Karnataka, 560016",Karnataka,9148982157,nrilayout.bangalore@lenskartstore.com,10:30 AM,09:30 PM,4.9,1121,560016
1536,Thammenahalli,"No 196 Mei Layout, 60Ft Main Road, Dassarahalli, Bengaluru, Karnataka, 560057",Karnataka,9148982137,bangalore.thamenhalli@lenskartstore.com,11:00 AM,09:30 PM,4.9,654,560057
257,Kengeri Satellite,"Shop No 1443, First Main Road, Kengeri Satellite Town, Hoysala Circle, Bengaluru, Karnataka, 560060",Karnataka,8029742524,kengeri.bangalore@dealskart.mobi,11:00 AM,09:30 PM,4.9,1638,560060
258,Kumaraswamy Layout,"Shop No 1319, 50 Feet Main Rd, Kumaraswamy Layout, Sri Lakshmi Venkateshwara Arcade, Bengaluru, Karnataka, 560078",Karnataka,8040932248,kumarswami.banglore@lenskart.mobi,11:00 AM,09:30 PM,4.8,961,560078
3,Flagship Store Empire Mall,"UG6 & UG8, Empire Mall, MG Road, SDM Law College, Mangaluru, Karnataka, 575003",Karnataka,9901930712,bigopticals.mangalore@lenskart.in,11:00 AM,09:00 PM,4.9,5115,575003
259,Uttarahalli Main Road,"Shop No 9/3, Site Number 46, Uttarahalli Main Road, Next To IDFC Bank, Bengaluru, Karnataka, 560061",Karnataka,9148982138,uttarahalli.bangalore@dealskart.mobi,11:00 AM,09:30 PM,4.9,1790,560061
1795,Keshwapur,"Vivanata Building, CTS No 439/1A-15, Ward No 30, Subhas Nagar, Kusugal Road, Keshwapur, Hubballi, Karnataka, 580023",Karnataka,8364063319,Hubli.keshwapur@lenskartstore.com,11:00 AM,09:30 PM,4.9,427,580023
260,Flagship Store at Nagarbhavi,"Shop No 1441/1309, Rajanna Complex, Jnanabharathi Main Road, Jyothi Nagar, Nagarbhavi Circle, Bengaluru, Karnataka, 560072",Karnataka,8951992076,nagarbhavi.bangalore@lenskart.mobi,11:00 AM,09:30 PM,4.9,2612,560072
