id,alt_store_name_catch,address_full,address_state,store_phone,store_email,business_hours_openi,business_hours_closi,averageRating,totalReviews,pincode
770,Trichy Cantt,"No 8, Bharathiar Salai, Melapudur, Cantonment, Tiruchirapalli, Tamil Nadu, 620001",Tamil Nadu,4314000733,cantonment.trichy@lenskartstore.com,11:00 AM,09:30 PM,4.9,1716,620001
1284,Nungambakkam,"Door No 125/1, Rose Wood Office, Nungambakkam High Road, Nungambakkam, Opposite Teresa Church, Chennai, Tamil Nadu, 600034",Tamil Nadu,4448061119,nungambakkamnew.chennai@lenskartstore.com,11:00 AM,09:30 PM,4.9,1882,600034
261,Jawahar Nagar,"Plot No B95, Old Door 37, New Door 22, First Main Road, Jawahar Nagar, Near Max Showroom, Chennai, Tamil Nadu, 600082",Tamil Nadu,4447943259,jawaharnagar.chennai@lenskart.in,11:00 AM,09:30 PM,4.9,1081,600082
1541,Meyyanur Bypass Road,"280/1, Sudarsan Building, Meyyanur Bypass Road, New Bus Stand Road, Meyyanur, Salem, Tamil Nadu, 636004",Tamil Nadu,4274520155,Meyyanurbypassroad.salem@lenskartstore.com,11:00 AM,09:30 PM,4.9,2135,636004
262,Perumbakkam,"G1, Plot No 3, Vgp Prabhu Nagar, Perumbakkam, Opposite Advent Church, Chennai, Tamil Nadu, 600100",Tamil Nadu,4447682948,perumbakkam.chennai@lenskart.mobi,11:00 AM,09:30 PM,4.9,1620,600100
774,Erode,"044/23, Paari Nagar, Paari Nagar, Near Med Plus, Erode, Tamil Nadu, 638011",Tamil Nadu,4242900313,erode.tamilnadu@lenskartstore.com,11:00 AM,09:00 PM,4.9,1066,638011
1290,100ft Bypass Road Velachery,"No 1 & 2 Main Road, Venkateswara Nagar, 100Ft Bypass Road, Velachery, Chennai, Tamil Nadu, 600042",Tamil Nadu,4445502138,velachery2.chennai@lenskartstore.com,11:00 AM,09:30 PM,4.9,1368,600042
1291,Sriperumbudur,"#154, Gandhi Road, Nenmeli, Opposite Iob, Sriperumbudur, Tamil Nadu, 602105",Tamil Nadu,8296421841,sriperambadur.chennai@lenskartstore.com,11:00 AM,09:30 PM,4.9,1465,602105
13,Brough Road,"No 272/A, Brough Road, Opposite CSI School Ground, Erode, Tamil Nadu, 638001",Tamil Nadu,4244020699,lenskarterode@gmail.com,11:00 AM,09:00 PM,4.8,1139,638001
782,Saligramam,"No 71, 1, Arcot Road, Vadapalani, Vadapalani, Chennai, Tamil Nadu, 600026",Tamil Nadu,4443054598,saligramanarcotroad.chennai@lenskartstore.com,11:00 AM,09:30 PM,4.9,2064,600026
783,Avinashi Road,"Shop No 702, Ground Floor, Esteem Complex, Opposite GKNM Hospital, Avinashi Road, Pn Palayam, Coimbatore, Tamil Nadu, 641018",Tamil Nadu,6380812667,avinashiroad.coimbatore@lenskartstore.com,10:30 AM,09:30 PM,4.9,784,641018
1040,Cuddalore,"No 20, Sanan Thottam, S N, Chavadi, Near Kv Tex, Cuddalore, Near Kv Tex, Cuddalore, Tamil Nadu, 607002",Tamil Nadu,7200883703,cuddalore.tamilnadu@lenskartstore.com,11:00 AM,09:00 PM,4.9,427,607002
786,Redhills,"183/16 Gnt Road, Redhills, Near Annamalai Cell City, Chennai, Tamil Nadu, 600052",Tamil Nadu,4442812599,redhills.chennai@lenskartstore.com,10:30 AM,09:30 PM,4.9,1324,600052
787,Periyar Nagar,"New No 42, Old No B126, Karthikeyan Salai, Periyar Nagar, Below To Kolors, Perambur, Tamil Nadu, 600082",Tamil Nadu,4447946297,periyar.chennai@lenskartstore.com,11:00 AM,09:30 PM,4.9,2410,600082
1043,Sai Baba Colony,"Ground Floor, #169, NSR Road, Saibaba Colony, Shaganoor, Coimbatore, Tamil Nadu, 641011",Tamil Nadu,4224201251,saibaba.coimbatore@lenskartstore.com,10:30 AM,09:30 PM,4.9,403,641011
1044,Vellore,"No 19/140, Laxman Complex, Arni Road, Near Cmc Eye Hospital, Vellore, Tamil Nadu, 632001",Tamil Nadu,4164204565,vellore.tamilnadu@lenskartstore.com,11:00 AM,09:00 PM,4.9,3366,632001
1301,Nanganallur,"38/13, 1St Main Road, Macmillan Colony, Nanganallur, Chennai, Tamil Nadu, 600061",Tamil Nadu,4442865441,nanganallur.chennai1@lenskartstore.com ,11:00 AM,09:30 PM,4.9,3355,600061
1304,Namakkal,"321/113B, Salem Road, Opposite Hotel Sanu International, Namakkal, Tamil Nadu, 637001",Tamil Nadu,8637628128,Namakkal.tamilnadu@lenskartstore.com,11:00 AM,09:00 PM,4.9,640,637001
1309,Perambur Moolakadai,"No 14, Madhavaram High Road Sembiam, Moolakadai, Perambur Road, Madhavaram, Opposite Simpon Gate No 1, Chennai, Tamil Nadu, 600011",Tamil Nadu,4443840065,Peramburmadhavaramhighroad.chennai@lenskartstore.com,11:00 AM,09:30 PM,4.9,1817,600011
1054,Iyer Bungalow,"Jaya Complex, 2/1121, 1St Floor, Natham Road, Madurai, Opposite To Bus Stop, Madurai, Tamil Nadu, 624014",Tamil Nadu,4524064831,Iyerbunglow.madurai@lenskartstore.com,11:00 AM,09:00 PM,4.9,1011,624014
799,Selaiyur,"27, Agaram Main Road, Ranganatha Nagar, Selaiyur, Chennai, Tamil Nadu, 600073",Tamil Nadu,7824834782,selaiyur.chennai@lenskartstore.com,11:00 AM,09:30 PM,4.9,1327,600073
1567,Kandanchavadi,"New No 08, Old No 6/169 Mgr Main Road, Govindaswamy Nagar 5Th Street, Kandanchavadi, Next To Gem Hospital, Chennai, Tamil Nadu, 600096",Tamil Nadu,9843330072,kandanchavadi.chennai@lenskartstore.com,11:00 AM,09:30 PM,5.0,1201,600096
291,"Ashok Nagar, Chennai","Shop No 38 (Old) 60 (New), Ground Floor, Jai Durga Apartment, Ashok Nagar, Chennai, Hot Chips, 1St Avenue, Chennai, Tamil Nadu, 600083",Tamil Nadu,4447689921,ashoknagar.chennai@lenskart.Mobi,11:00 AM,09:30 PM,4.9,1806,600083
803,Chengalpet,"No 11, Joesph Towers, Gst Main Road, Alagesan Nagar Extention, Chengalpet, Opposite Reliaince Trends, Kanchipuram, Tamil Nadu, 603001",Tamil Nadu,9363613262,Chengalpet.tamilnadu@lenskartstore.com,10:30 AM,09:30 PM,4.9,690,603001
1059,Simmakkal,"109, Vakkilnew Street, Northmart Street, Madurai Main, Madurai, Opposite Simmakkal Bus Stand, Madurai, Tamil Nadu, 625001",Tamil Nadu,4524050036,simakkal.madurai@lenskartstore.com,11:00 AM,09:00 PM,4.9,938,625001
1060,Urapakkam,"Urapakkam Flyover, Sri Balaji Nagar, Urapakkam, Perungalathur, Urapakkam, Chennai, Tamil Nadu, 603211",Tamil Nadu,8148140982,urapakkam.chennai@lenskartstore.com,11:00 AM,09:30 PM,4.9,943,603211
294,Thiruvottiyur,"Shop No 93, Ssm Complex, Rajakadai, Thiruvottiyur, Opposite Rohit Hospital, Chennai, Tamil Nadu, 600019",Tamil Nadu,4447704250,thiruvottiyur.chennai@lenskart.mobi,11:00 AM,09:00 PM,4.9,1662,600019
1062,Velachery,"No 26, 15/17A, Velachery Bypass Road, Rajalakshmi Nagar, Velachery, Chennai, Tamil Nadu, 600042",Tamil Nadu,4447683492,Velachery1.chennai@lenskartstore.com,11:00 AM,09:30 PM,4.9,1215,600042
1318,Aminjikarai,"Old # 295, New # 507, Ph Road, Aminjikarai, Chennai, Tamil Nadu, 600029",Tamil Nadu,8296728659,aminjikarai.chennai@lenskartstore.com,11:00 AM,09:30 PM,4.9,1304,600029
1575,Singaperumal Koil,"9/6, Gst Road, Periyar Street, Periya Vinjiyam Bakkam, Singaperumal Koil, Opposite Icici Bank, Chennai, Tamil Nadu, 603204",Tamil Nadu,9087870500,singaperumalkoil.chennai@lenskartstore.com,11:00 AM,09:30 PM,4.9,812,603204
40,West K K Nagar,"Shop No 1069, Munusamy Salai, West K K Nagar, Next To Puducherry Guest House, Chennai, Tamil Nadu, 600078",Tamil Nadu,9176291381,tventures.chennai@lenskart.mobi,11:00 AM,09:00 PM,4.8,1100,600078
1064,Tirumullaivoyal,"No 62/1, Cth Road, Near Ss Briyani, Thirumullaivoyal, Opposite Indian Bank, Chennai, Tamil Nadu, 600062",Tamil Nadu,4448051725,Thirumalvayul.chennai@lenskartstore.com,10:30 AM,09:30 PM,4.9,1151,600062
1320,kavundampalayam,"14, Mettupalayam Main Road, Jayathi Nagar, Kavundampalayam, Coimbatore, Tamil Nadu, 641030",Tamil Nadu,8015040696,kavundampalayam.coimbatore@lenskartstore.com,10:30 AM,09:30 PM,4.9,856,641030
1577,Race Course Road,"Door No 86, Rathinam Circle View Building, Race Course Road, Coimbatore, Tamil Nadu, 641018",Tamil Nadu,4224717204,Racecourseroad.coimbatore@lenskartstore.com,10:30 AM,09:30 PM,4.9,910,641018
42,Fairlands,"17/21, Ground Floor, Brindavan Road, Fairlands, Near Sarada Vidyalaya School, Salem, Tamil Nadu, 636016",Tamil Nadu,4274552022,orngenterprises.salem@lenskart.mobi,11:00 AM,09:00 PM,4.9,1904,636016
300,"Phoenix Market City Mall, Velachery","Shop No 142, 1St Floor, Phoenix Market City Mall, Velachery, Next To Raymonds Showroom, Chennai, Tamil Nadu, 600042",Tamil Nadu,6384449469,phoenix.chennai@lenskart.mobi,11:00 AM,10:00 PM,4.9,2764,600042
46,RS Puram,"Shop No. 581/1, Db Road, Rs Puram, Near Eye Foundation, Coimbatore, Tamil Nadu, 641002",Tamil Nadu,9003814249,samyrd.coimbatore@lenskart.mobi,10:30 AM,09:30 PM,4.8,2282,641002
302,Rajakilpakkam,"Shop No 31, Plot No 1, Sembakkam, Mgr Street, Rajakilpakkam, Near To New Life Hospital, Chennai, Tamil Nadu, 600073",Tamil Nadu,9087873119,rajakilpakkam.chennai@lenskart.mobi,11:00 AM,09:30 PM,4.9,2752,600073
814,Ambedkar Road,"Ssa Arcade, 10/1, Ground Floor, Dr Ambedkar Road, 4Th Avenue, Ashok Nagar, Opposite Thick Shake Factory, Chennai, Tamil Nadu, 600083",Tamil Nadu,4442659331,ambedkarroad.chennai@lenskartstore.com,11:00 AM,09:30 PM,4.9,2391,600083
817,RS Puram,"No 121 Tv Swamy Road, West Rs Puram, Opposite Krs Bakery, Coimbatore, Tamil Nadu, 641002",Tamil Nadu,4224937368,tvswamyroad.coimbatore@lenskartstore.com,10:30 AM,09:30 PM,4.8,1086,641002
1074,Flagship Store Avadi,"210, Nehru Bazar, Ph Road, Avadi, Near Chinnamman Temple, Chennai, Tamil Nadu, 600054",Tamil Nadu,6384449470,avadinmkroad1.chennai@lenskartstore.com,10:30 AM,09:30 PM,4.9,1115,600054
1843,Pallavaram Market,"# 8/14, Indira Gandhi Road, C Pallavaram, Chennai, Tamil Nadu, 600043",Tamil Nadu,9087870300,Pallavaram.chennai1@lenskartstore.com,11:00 AM,09:30 PM,4.9,1037,600043
1076,Tirunelveli,"55 C, 22, 23 High Road, Raja Building ,Opposite Old Bus Stand, 55 C, 22, 23 High Road, Raja Building, Tirunelveli, Tamil Nadu, 627001",Tamil Nadu,4624820982,Tirunelveli.tamilnadu2@lenskartstore.com,11:00 AM,09:00 PM,4.9,726,627001
1333,Ganapathy,"No 328, Sathy Road, Athipalayam Pirivu, Prashakthi Nagar, Ganapathy, Ganapathy, Opposite Shiva Hospital, Coimbatore, Tamil Nadu, 641006",Tamil Nadu,9790942929,ganapatthy.coimbatore@lenskartstore.com,10:30 AM,09:30 PM,4.9,417,641006
1589,Gugai,"#132/13, Sankagiri Main Road, Thadhagapatty, Gugai, Near Prabhas Theater Signals, Salem, Tamil Nadu, 636006",Tamil Nadu,4274521509,Salem.gugai@lenskartstore.com,11:00 AM,09:30 PM,4.9,2186,636006
310,Navalur,"Shop No 22, Rajiv Gandhi Salai, Navalur, Kanchipuram, Opposite Ags Cinemas, Chennai, Tamil Nadu, 603103",Tamil Nadu,6384449468,navalur.chennai@lenskartstore.com,11:00 AM,09:30 PM,4.9,1834,603103
823,Besant Nagar,"11, Annai Velankani Road, Ashtalakshmi Garden, Besant Nagar, Chennai, Next To Axis Bank, Chennai, Tamil Nadu, 600090",Tamil Nadu,4443229992,Besanthnagar.chennai@lenskartstore.com,11:00 AM,09:30 PM,4.9,1238,600090
1079,Mowlivakkam,"5C, 212, Kundrathur Road, Moulivakkam, Chennai, Tamil Nadu, 600125",Tamil Nadu,7550066014,mowlivakkam.chennai@lenskartstore.com ,11:00 AM,09:30 PM,4.9,1005,600125
1341,Madhanandapuram,"No 112, Mugalivakkam Main Road, Santhosh Nagar, Madhanandapuram, Chennai, Tamil Nadu, 600125",Tamil Nadu,4448577832,madanadapuram.chennai@lenskartstore.com,11:00 AM,09:30 PM,4.9,486,600125
830,Perungudi,"48, 4, Old Mahabalipuram Road, Tirumalai Nagar, Perungudi, Next To World Trade Centre, Chennai, Tamil Nadu, 600096",Tamil Nadu,9087873112,perungudiomr.chennai@lenskartstore.com ,11:00 AM,09:30 PM,4.9,1887,600096
576,Karayanchavadi,"Ground Floor, Dj Complex, 52 Trunk Road, Karayanchavadi, Poonamalle, Chennai, Tamil Nadu, 600056",Tamil Nadu,4447900755,karayanchavadi.chennai@lenskartstore.com,11:00 AM,09:30 PM,4.9,1284,600056
1088,Mount Road,"No 117/2, Mount Road, Anna Salai, Next To Sangam Hotel, Chennai, Tamil Nadu, 600002",Tamil Nadu,8296253791,mountroad.chennai@lenskartstore.com,11:00 AM,09:30 PM,4.9,1017,600002
834,Porur Arcot Road,"3, Arcot Road, Sai Nagar, Porur Arcot Road, Next To Sony Centre, Chennai, Tamil Nadu, 600116",Tamil Nadu,4443865159,Porur.chennai@lenskartstore.com ,11:00 AM,09:30 PM,4.9,912,600116
1094,Salem,"No 423, Jaguar Ammapalayam Kasakaranoor, Junction Main Road Salem, Opposite Sona Salem College, Salem, Tamil Nadu, 636005",Tamil Nadu,8807851959,salem.tamilnadu@lenskartstore.com ,11:00 AM,09:00 PM,4.9,1464,636005
1606,Krishnagiri,"1/374-1, Rajaji Nagar, Rayakottai Road, Rajajinagar, Opposite Rbl Bank, Krishnagiri, Tamil Nadu, 635001",Tamil Nadu,4343457067,Avinashiroadhopescollege.coimbatore@lenskartstore.com,11:00 AM,09:00 PM,4.9,608,635001
839,Trichy Karur Bypass Road,"11, Mc Arcade No 9, Karur Bypass Road, Annamalai Nagar, Next To Benelli Bike Showroom, Tiruchirappalli, Tamil Nadu, 620018",Tamil Nadu,4314509974,Karur.trichy@lenskartstore.com,11:00 AM,09:30 PM,4.9,1257,620018
840,Kilpauk,"62C, Ormes Road, Kilpauk, Next To Orms Junction, Chennai, Tamil Nadu, 600010",Tamil Nadu,8197624730,kilpauk.chennai@lenskartstore.com,11:00 AM,09:30 PM,4.8,820,600010
329,Madipakkam,"Shop No 3, Medavakkam Main Road, Madipakkam, Below Indian Bank, Chennai, Tamil Nadu, 600091",Tamil Nadu,4448578676,madipakkam.chennai@lenskartstore.com,11:00 AM,09:30 PM,4.9,1625,600091
841,Ramanathapuram,"1114 B, Sungam, Ramanathapuram, Trichy Road, Sungam, Coimbatore, Tamil Nadu, 641045",Tamil Nadu,4224378238,ramanathapuram.coimbatore@lenskartstore.com,10:30 AM,09:30 PM,4.9,1014,641045
1865,200ft Radial Road,"Survey No 257/4-B, Zamin Pallavaram, 200ft Radial Road, Taluk Tambaram, District Kancheepuram, Chennai, Tamil Nadu, 600044",Tamil Nadu,9087871300,200ftroad.chennai@lenskartstore.com,11:00 AM,09:30 PM,4.9,1300,600044
330,Flagship Store at Adyar,"Shop No 57, Kg Vallencia, First Main Road, Gandhi Nagar, Adyar, Opposite Ramkey Tvs, Chennai, Tamil Nadu, 600020",Tamil Nadu,9087870582,adyar.chennai@lenskartstore.com,10:30 AM,09:30 PM,4.9,2416,600020
1098,Porur,"23, Trunk Road, Jaya Nagar, Porur Junction, Chennai, Tamil Nadu, 600116",Tamil Nadu,4448046408,Porur1.chennai@lenskartstore.com,11:00 AM,09:30 PM,4.9,808,600116
331,Valasaravakkam,"Shop No 173, RA Complex, Arcot Road, Opposite Idfc First Bank, Valasaravakkam, Chennai, Tamil Nadu, 600087",Tamil Nadu,4447943249,valasaravakkam.chennai@lenskartstore.com,11:00 AM,09:30 PM,4.9,2793,600087
587,Oggiyamduraipakkam,"Plot No 6, 200 Ft Radial Road, Sai Nagar, Toll Plaza Thoraippakkam, Sai Nagar, Chennai, Tamil Nadu, 600097",Tamil Nadu,4449585732,thoraipakkam.chennai@lenskartstore.com,11:00 AM,09:30 PM,4.9,1633,600097
1099,Flagship Store Madipakkam,"No 11, Madipakkam, Main Road Kaiveli, Velachery, Opposite Barath Petrol Bunk, Chennai, Tamil Nadu, 600042",Tamil Nadu,4449567526,Maddipakkam.chennai@lenskartstore.com,11:00 AM,09:30 PM,4.9,1509,600042
590,Perambur,"Shop No 68, Ground Floor, Paper Mills Road, Perambur, Near Perumbur Church, Chennai, Tamil Nadu, 600011",Tamil Nadu,4445542899,perumburstore.chennai@lenskartstore.com,11:00 AM,09:30 PM,4.9,3723,600011
1358,Kalavasal Bypass Road,"P T R Complex, No 56, Kalavasal Bypass Road, Kalavasal, Madurai, Tamil Nadu, 625010",Tamil Nadu,9087871500,kalavasalbypass.madurai@lenskartstore.com,11:00 AM,09:30 PM,4.9,1357,625010
1617,Mettupalayam,"No 117, Karamadai Road, Coimbatore Main Road, Near Axis Bank, Mettupalayam, Tamil Nadu, 641301",Tamil Nadu,4254466019,metupalayam.coimbatore@lenskartstore.com,11:00 AM,09:30 PM,4.9,728,641301
338,Moggapair West,"Pc 2/6, Second Block, Moggapair West, Near Bharat Petroleum Petrol Pump, Chennai, Tamil Nadu, 600037",Tamil Nadu,9087879702,mogappair.chennai@lenskartstore.com,10:30 AM,09:30 PM,4.8,1187,600037
1113,Tirupattur,"N0 50, Palanisamy, Road, Opposite Indian Oil Petrol Pump, Tirupattur, Tamil Nadu, 635601",Tamil Nadu,4179299250,tirupattur.tamilnadu@lenskartstore.com ,11:00 AM,09:00 PM,4.9,407,635601
602,Gandhi Nagar,"Shop No 29/15, Jayliz Junction, Azad Road, Gandhi Nagar, Aravind Eye Hospital Road, Gandhi Nagar, Near Anna Bus Stand, Madurai, Tamil Nadu, 625020",Tamil Nadu,9962718808,gandhinagar.madurai@lenskartstore.com,11:00 AM,09:00 PM,4.8,725,625020
858,Kolathur,"No 66 & 67, Sivanandha Nagar, 200 Feet Road, Kolathur, Kolathur, Near Sendhil Nagar Bus Stop, Chennai, Tamil Nadu, 600099",Tamil Nadu,8197093648,kolathur.chennai01@lenskartstore.com,11:00 AM,09:30 PM,4.9,2269,600099
347,Flagship Store at Thuraipakkam,"Shop No 5/351, Omr Road, Okkiyampettar, Thuraipakkam, Opposite Indian Oil Petrol Pump, Chennai, Tamil Nadu, 600097",Tamil Nadu,9087873114,chennai.thoraipakkam@lenskartstore.com,11:00 AM,09:30 PM,4.9,1619,600097
1115,Tambaram,"TJP Complex, GST Road, Tambaram Sanatorium, Tambaram, Chennai, Tamil Nadu, 600045",Tamil Nadu,9087870580,tambaramnew.chennai@lenskartstore.com,11:00 AM,09:30 PM,4.9,877,600045
92,West Mambalam,"Shop No 37/B, Aryagowda Road, Postal Colony, West Mambalam, Opposite West Mambalam Post Office, Chennai, Tamil Nadu, 600033",Tamil Nadu,7299959555,mambalam.chennai@lenskart.mobi,11:00 AM,09:30 PM,4.9,1674,600033
1117,Sulur,"3 & 4A, Ground Floor, Sri Ramana Complex, Trichy Road, Sulur, Near Rvs College Arts & Science, Coimbatore, Tamil Nadu, 641402",Tamil Nadu,8807981139,sulur.coimbatore@lenskartstore.com,10:30 AM,09:30 PM,4.9,1349,641402
1118,Marthandam,"Block 2, 2 63 E, C P Sons Complex, Ammankoil, Marthandam, Kanyakumari, Tamil Nadu, 629165",Tamil Nadu,9962235419,marthandam.tamilnadu@lenskartstore.com,11:00 AM,09:00 PM,4.9,416,629165
2142,Anuparpalayam,"No 3, Avinashi Road, Gandhi Road Junction, Anupparpalayam, Tiruppur, Tamil Nadu, 641652",Tamil Nadu,4216610628,Avinashird.tiruppur@lenskartstore.com,10:30 AM,09:30 PM,5.0,301,641652
1119,Anna Nagar,"No 335 1, 80Ft Road, Anna Nagar, Sathamangalam, Anna Nagar, Near Hdfc Bank, Madurai, Tamil Nadu, 625020",Tamil Nadu,4524069980,annanagar.madurai@lenskartstore.com,11:00 AM,09:30 PM,4.9,1955,625020
1120,Saidapet,"Old No 118, New Door No 16, Bazzar Road, Saidapet, Chennai, Tamil Nadu, 600015",Tamil Nadu,4447943262,Saidapet.chennai@lenskartstore.com,11:00 AM,09:30 PM,5.0,2129,600015
1128,RK Mutt Road,"234, Rk Mutt Road, Mylapore, Mylapore, Chennai, Tamil Nadu, 600004",Tamil Nadu,4440069049,Mylaporerkmuttrd.chennai@lenskartstore.com,11:00 AM,09:30 PM,4.9,1264,600004
1641,Sivakasi,"Ts No 5/63, Babuji Complex, Gandhi Road, Parapatti, Sivakasi, Tamil Nadu, 626123",Tamil Nadu,4562221772,sivakashi02.tamilnadu@lenskartstore.com,11:00 AM,09:00 PM,4.9,966,626123
106,Nethaji Road,"9-C Nethaji Byepass Road, Hotel Agarwal Bavan Building, Next to DDCC Bank, Dharmapuri, Tamil Nadu, 636701",Tamil Nadu,9994448386,dharmapuri.tn@lenskart.mobi,11:00 AM,09:00 PM,4.9,1379,636701
107,Thillai Nagar,"Store No A5, Passport Office Building, Shastri Road, Thillai Nagar, Megastar Cinema, Tiruchirappalli, Tamil Nadu, 620018",Tamil Nadu,4314060699,salai.trichy@lenskart.mobi,10:30 AM,09:30 PM,4.9,1681,620018
111,"Katpadi, Vellore","Shop No 1, Gds Complex, Green Circle, New Katpadi Road, Katpadi, Opposite New Bus Stand, Vellore, Tamil Nadu, 632004",Tamil Nadu,8903026222,katpadi.vellore@lenskart.mobi,11:00 AM,09:00 PM,4.8,1251,632004
112,Avinashi Road,"Shop No 441, Peelamedu, Peelamedu, Opposite Sms Hotel, Coimbatore, Tamil Nadu, 641004",Tamil Nadu,4224718721,avinashiroad.coimbatore@lenskart.mobi,10:30 AM,09:30 PM,4.8,1496,641004
1904,Kalavasal Junction,"100, Next to Westside Showroom, Kalavasal Junction, Theni Road, Madurai, Tamil Nadu, 625016",Tamil Nadu,9087871200,Thenird.madurai@lenskartstore.com,11:00 AM,09:30 PM,,,625016
625,Keelkattalai,"#100, Ground Floor, Medavakam Main Road, Keelkattalai, Chennai, Tamil Nadu, 600117",Tamil Nadu,4442136983,Keelkattalai_Chennai@lenskartstore.com,11:00 AM,09:30 PM,4.9,1394,600117
1140,"MKB Nagar, Chennai","No 22, Kambar Street, Vivekananda Nagar, Mkb Nagar, Kodungaiyur, Opposite Hp Petrol Pump, Chennai, Tamil Nadu, 600118",Tamil Nadu,4448042011,mkbnagar.chennai@lenskartstore.com,11:00 AM,09:30 PM,4.9,1511,600118
1141,Hastinapuram,"52, Dr Rajendra Prasad Road, Kumudham Colony, Nehru Nagar, Hastinapuram, Chromepet, Chennai, Tamil Nadu, 600064",Tamil Nadu,4447943261,hastinapuram.chennai@lenskartstore.com ,11:00 AM,09:30 PM,4.9,1304,600064
1397,Injambakkam ECR,"Plot B, Survey No 56/1A Ground Floor, Promenade Sh49, Ecr Injambakkam, Opposite Vgp, Chennai, Tamil Nadu, 600115",Tamil Nadu,6384449464,injambakkam.chennai@lenskartstore.com ,11:00 AM,09:30 PM,4.9,631,600115
1910,Thillai Nagar,"31/1, Thillai Nagar 1-24, 3Rd Cross, Tiruchirapalli, Tamil Nadu, 620018",Tamil Nadu,4314519501,Thillainagar.trichy@lenskartstore.com,11:00 AM,09:30 PM,4.9,391,620018
2168,Chinmayanagar,"Survey No 102, Patta No 74, 104, Kaliamman Koil St, Virugambakkam, Chinmayanagar, Chennai, Tamil Nadu, 600092",Tamil Nadu,4447816503,Chinmayanagar.chennai@lenskartstore.com,11:00 AM,09:30 PM,4.9,622,600092
1659,Kanchipuram Nambi Street,"Ground Floor No 31, Thirukachi Nambi Street, Near Pachaiyappa's Women College Bus Stop, Kanchipuram, Tamil Nadu, 631501",Tamil Nadu,4427269800,kanchipuram.chennai1@lenskartstore.com,11:00 AM,09:30 PM,4.9,1093,631501
1149,Nelson Manickam Road,"154/24 A, Nelson Manickam Road, Metha Nagar, Near Shobhan Babu Statue, Chennai, Tamil Nadu, 600029",Tamil Nadu,4443150637,nelsonmanickamroad.chennai@lenskartstore.com,11:00 AM,09:30 PM,5.0,1650,600029
638,Mayanz Forum,"Ground Floor, Mayanz Forum, Building No 27, Mettupalayam Road, Thudiyalur, Tamil Nadu, 641034",Tamil Nadu,8122043770,thudiyalurroad.coimbatore@lenskartstore.com,10:30 AM,09:30 PM,4.9,1199,641034
1663,Ammapet,"176/1, Chairman Ramalingam Road, Near Soundaraja Perumal Kovil, Ammapet, Salem, Tamil Nadu, 636001",Tamil Nadu,4274519385,ammapet.salem@lenskartstore.com,11:00 AM,09:30 PM,4.9,1729,636001
384,Prozone Mall,"Shop No G18, Ground Floor, Old Sivanandha Mills, Sivanandhapuram, Prozone Mall, Coimbatore, Tamil Nadu, 641035",Tamil Nadu,4226628188,prozonemall.coimbatore@lenskartstore.com,11:00 AM,09:30 PM,4.8,870,641035
1156,Kumbakonam,"Sd Groups No 9, Someswarar Sannathi Street, Near Utchipillaiyar Kovil, Kumbakonam, Tamil Nadu, 612001",Tamil Nadu,4352423787,kumbakonam.tamilnadu@lenskartstore.com ,10:30 AM,09:30 PM,4.9,866,612001
904,MMDA Colony Arumbakkam,"No 26, Vinayagapuram Street, 1St Main Road, Mmda Colony Arumbakkam, Mmda Colony Arumbakkam, Opposite Apollo Pharmacy, Chennai, Tamil Nadu, 600106",Tamil Nadu,8951206808,mmdacolony.chennai@lenskartstore.com,11:00 AM,09:30 PM,4.9,1301,600106
1164,Adambakkam Brindhavan Road,"5, Sakthi Nagar Main Road, Adambakkam, Near Nayana Petrol Pump, Chennai, Tamil Nadu, 600088",Tamil Nadu,4445576238,adambakkambrindavanroad.chennai@lenskartstore.com,11:00 AM,09:30 PM,4.9,2664,600088
1422,18th Main Road Anna Nagar,"269, 18Th Main Road, Udhayam Colony, Anna Nagar, 18Th Main Road, Chennai, Tamil Nadu, 600040",Tamil Nadu,8197621575,18thmainroad.chennai@lenskartstore.com,11:00 AM,09:30 PM,4.9,1417,600040
400,Flagship Store at Chrompet,"Shop No 212, Ground Floor, Gst Road, , Chrompet, Near Chrompet Railway Station, Chennai, Tamil Nadu, 600044",Tamil Nadu,9087873121,chrompet.chennai@lenskartstore.com,11:00 AM,09:30 PM,4.9,2872,600044
915,Ondipudur,"2334 Ondipudur Trichy Road, Ondipudur Bus Stop, Ondipudur, Opposite The Chennai Mobiles, Coimbatore, Tamil Nadu, 641016",Tamil Nadu,7305138792,ondipurtrichyroad.coimbatore@lenskartstore.com,10:30 AM,09:30 PM,4.9,871,641016
2196,MG Road,"358-368, MG Road, Stainte Therese Street Junction, Opposite Petit Seminare School, Puducherry, Tamil Nadu, 605001",Tamil Nadu,7010623234,Mgroad.pondicherry@lenskartstore.com,11:00 AM,09:30 PM,4.9,96,605001
1685,Kattur Bypass Trichy,"SF No 2B1 & A1, Thanjavur Main Road, Ellakudi, Kattur, Tiruchirappalli, Tamil Nadu, 620019",Tamil Nadu,4314510906,Katturbypass.trichy@lenskartstore.com,11:00 AM,09:00 PM,4.9,909,620019
921,Tambaram,"Shop No 12/B, Ground Floor, Kakkan Street, West Tambaram, Next To Vidhya Theatre, Chennai, Tamil Nadu, 600045",Tamil Nadu,9087875700,Tambaramkakkan.chennai@lenskartstore.com,11:00 AM,09:30 PM,4.9,1381,600045
1177,Perungalathur,"New No 24, Old No 42, Kalaignar Nedunchalai, Srinivasanagar, Perungalathur, Chennai, Tamil Nadu, 600063",Tamil Nadu,4447686236,perungalathur.chennai@lenskartstore.com ,11:00 AM,09:30 PM,4.9,835,600063
2203,Ponneri,"#63, NGO Nagar Extension, Hariharan Bazaar Street, Opposite Reliance Trends, Ponneri, Thiruvallur, Tamil Nadu, 601204",Tamil Nadu,7418346820,ponneri2.chennai@lenskartstore.com,10:30 AM,09:30 PM,5.0,574,601204
415,Flagship Store at Anna Nagar,"Shop No Ab152, Flat No 41B, 4Th Avenue, Shanthi Colony, Anna Nagar, Opposite Srivari Sweets, Chennai, Tamil Nadu, 600040",Tamil Nadu,4447858701,shanthicolony.chennai@lenskartstore.com,11:00 AM,09:30 PM,4.9,6592,600040
928,Saravanampatti,"95/1b, Next to Federal Bank, Sathy Road, Saravanampatti, Opposite Guruamuthas Veg Tradition, Coimbatore, Tamil Nadu, 641035",Tamil Nadu,4224385568,saravanampatti.coimbatore@lenskartstore.com,10:30 AM,09:30 PM,4.8,901,641035
2211,Kattupakkam,"2/220, Kattupakkam Main Road, No 47, Taluk Ponnamallee South, Chennai, Tamil Nadu, 600056",Tamil Nadu,4426790131,kattupakkam.chennai@lenskartstore.com,11:00 AM,09:30 PM,4.9,124,600056
677,Kovai Road,"Door No 61 & 62, Shop No 7 & 8, Municipality Ward No 6, Kovai Road, Pollachi, Tamil Nadu, 642002",Tamil Nadu,9566749464,pollachi.tamilnadu@lenskartstore.com,11:00 AM,09:00 PM,4.8,503,642002
1445,Kumaran Road,"1267 & 262, Kumaran Road, Tiruppur, Tamil Nadu, 641601",Tamil Nadu,4214265758,Kumaran.tiruppur@lenskartstore.com,10:30 AM,09:30 PM,4.9,1228,641601
937,Triplicane,"203/360, Triplicane High Road, Triplicane, Opposite To South Indian Bank, Chennai, Tamil Nadu, 600005",Tamil Nadu,8951963065,Triplicanehighrd.chennai@lenskartstore.com,11:00 AM,09:30 PM,4.9,594,600005
1449,Adambakkam,"No 33 & 56, Old, Vellalar St, Near to Grace Super Market, Paramesh Nagar, Adambakkam, Chennai, Tamil Nadu, 600088",Tamil Nadu,4445267557,adambakkam.chennai@lenskartstore.com,11:00 AM,09:30 PM,4.9,1538,600088
1200,Kuniyamuthur,"No 396, Palakkad Main Road, Kuniyamuthur, Near Reliance Kannan Smart, Coimbatore, Tamil Nadu, 641008",Tamil Nadu,9791244474,Kuniyamuthur.tamilnadu@lenskartstore.com,10:30 AM,09:30 PM,4.9,2610,641008
177,Asher Nagar,"No 137/8/86, Avinashi Road, Asher Nagar, Opposite Indian Oil Petrol Pump, Tiruppur, Tamil Nadu, 641603",Tamil Nadu,4214977988,Asher.tiruppur@lenskartstore.com,11:00 AM,09:00 PM,4.8,1155,641603
