id,alt_store_name_catch,address_full,address_state,store_phone,store_email,business_hours_openi,business_hours_closi,averageRating,totalReviews,pincode
772,Vizianagaram,"20-20-103, Plot No103, Madhuvan Towers, Krishnarajapuram, Near Spencers, Vizianagaram, Andhra Pradesh, 535002",Andhra Pradesh,9392738592,vizianagaram.andhrapradesh@lenskartstore.com,11:00 AM,09:00 PM,4.9,1346,535002
7,Ramnagar,"Shop No 10/4/16/2, Upper Ground Floor, Uplands Road, Asilmetta Junction, Ramnagar, Beside Hotel Meghalaya, Visakhapatnam, Andhra Pradesh, 530003",Andhra Pradesh,9177647575,lenskart.vizag@gmail.com,11:00 AM,09:30 PM,4.8,5726,530003
1032,Kakinada,"20-1-34, Subash Road, Opposite Super Bazar, Kakinada, Andhra Pradesh, 533001",Andhra Pradesh,9848279279,kakinada.andhrapradesh@lenskartstore.com,11:00 AM,09:00 PM,4.9,1200,533001
779,Eluru,"24B-1-46/1, Vijaya Vihar Centre, Vijaya Vihar Centre, Opposite Gv Mall, Eluru, Andhra Pradesh, 534002",Andhra Pradesh,9097346346,eluru.andhrapradesh@lenskartstore.com,11:00 AM,09:00 PM,4.8,722,534002
23,Shanthi Nagar,"Shop No 23/7/131, Shanthi Nagar, Mr Palli Circle, Tirupati, Andhra Pradesh, 517502",Andhra Pradesh,6309868263,lenskart.tirupati@gmail.com,11:00 AM,09:00 PM,4.9,2363,517502
1306,Gajuwaka,"10-1-128/7, 60 Feet Wide Road, Mehar Nagar, Gajuwaka, Visakhapatnam, Andhra Pradesh, 530026",Andhra Pradesh,9502706803,Gajuwaka.vizag@lenskartstore.com,11:00 AM,09:30 PM,4.9,2946,530026
1311,Brodipet,"45029, Brodipet, Brodipet, Opposite Vajram Hotel, Guntur, Andhra Pradesh, 522002",Andhra Pradesh,8074000799,guntur85.andhrapradesh@lenskartstore.com,11:00 AM,09:00 PM,4.9,1011,522002
1312,Nandyal Road Kurnool,"D No 87/1133, Nandyal Road, Sree Rajeswari Nagar, Sree Rajeswari Nagar, Kurnool, Andhra Pradesh, 518002",Andhra Pradesh,9346274788,kurnool.andhrapradesh@lenskartstore.com,11:00 AM,09:00 PM,5.0,2151,518002
1829,Satyanarayanapuram,"21-3-7, Bagath Singh Road, Govt Press, Mutyalampadu Vijayawada, Satyanarayanapuram, Andhra Pradesh, 520011",Andhra Pradesh,8341004766,Satyannarayanapuram.hyderabad@lenskartstore.com,10:30 AM,09:30 PM,4.9,369,520011
1833,Guru Nanak Colony,"59A-20-2, Survey No 134/6, Extent 443.33, South Plot No 29, East Plot No 23 West, Plot No 21, Guru Nanak Colony, Vijayawada, Andhra Pradesh, 520007",Andhra Pradesh,8341001255,Gurunanakcolony.vijayawada@lenskartstore.com,10:30 AM,09:30 PM,4.9,594,520007
1580,Vijayawada,"H No 27-1-86, Satya, Estates, Muddha Subaiah Street, Lenin Center, Governpet, Elur Road, Patamata, Near Ntr Circle, Vijayawada, Andhra Pradesh, 520010",Andhra Pradesh,8522888402,patamata.vijayawada@lenskartstore.com,10:30 AM,09:30 PM,4.8,432,520010
1603,Tenali,"Ground Floor, Old Badari Shop, Bose Road, Tenali, Andhra Pradesh, 522201",Andhra Pradesh,8644232655,tenali.andhrapradesh@lenskartstore.com,11:00 AM,09:00 PM,4.9,565,522201
836,VV Mahal Road,"Door No 18/1/635, Ground Floor Bhavani Nagar, V V Mahal Road, Near Municipal Office, Tirupati, Andhra Pradesh, 517501",Andhra Pradesh,8772955990,tirupatichittoor.andhrapradesh@lenskartstore.com,11:00 AM,09:00 PM,4.9,2633,517501
76,"MG Road, Vijayawada","Shop No 40/1/50, Gvr Complex, Chandramouli Puram, Mg Road, Opposite M&M, Vijayawada, Andhra Pradesh, 520010",Andhra Pradesh,8790721572,benzcircle.vijayawada@lenskart.mobi,11:00 AM,09:30 PM,4.7,1934,520010
81,Butchirajupalem NAD Junction,"D No 58/1/373, Ground Floor, Main Road, Butchirajupalem Nad Junction, Near St. Thomas Church, Visakhapatnam, Andhra Pradesh, 530027",Andhra Pradesh,8106017474,vadim.vizag@lenskart.mobi,11:00 AM,09:30 PM,4.9,2445,530027
1879,Seetarapuram,"DNo 143, Revenue Ward 9, Municipal Ward No 23, 262, Assesment No 23029 A, Gunadala Krishana, Seetaraampuram, Elur Road, Vijayawada, Andhra Pradesh, 520002",Andhra Pradesh,8341006766,Vijayawda.seetharampura@lenskartstore.com,10:30 AM,09:30 PM,4.9,407,520002
90,R S Road,"Shop No 40/581/A, Sv Complex, Rs Road, Prakash Nagar, Opposite Tj Shopping Mall, Kurnool, Andhra Pradesh, 518004",Andhra Pradesh,9603466031,karnool.ap@lenskart.mobi,11:00 AM,09:00 PM,4.9,1815,518004
91,Tilak Road,"Shop No 2G, Srihari Soudha Building, DNo 79/2/4/4, Tilak Road, Opposite Karur Vysya Bank, Rajahmundry, Andhra Pradesh, 533103",Andhra Pradesh,7095059807,rajahmundry.ap@lenskart.mobi,11:00 AM,09:00 PM,4.8,1634,533103
2147,GT Road VRC Centre,"Shop No 17/288/1, Ground Floor, Keerthy Towers, Grand Trunk Road, VRC Centre, Nellore, Andhra Pradesh, 524001",Andhra Pradesh,8614019013,Nelloregtroad.tirupati@lenskartstore.com,10:30 AM,09:30 PM,4.9,414,524001
1124,"Vizag, Seethammadara","50-111-1, Seethammadhara Road, Tpt Colony, Balayya Sastri Layout, Seethammadara, Visakhapatnam, Andhra Pradesh, 530013",Andhra Pradesh,9347210695,Seethammadara.vizag@lenskartstore.com,11:00 AM,09:30 PM,5.0,2775,530013
869,Guntur,"No 12/25/46/A, Revenue Ward 27, Assessment No, 76262, 76263, Ground Floor, Kothapet Main Road, Kothapet, Opposite Sudarshan Eye Hospital, Guntur, Andhra Pradesh, 522001",Andhra Pradesh,8328578545,guntur.andhrapradesh@gmail.com,11:00 AM,09:30 PM,4.9,1311,522001
1382,Madanapalle,"4-55,56, Modem Towers, Patel Road, Annamayya, Madanapalle, Andhra Pradesh, 517325",Andhra Pradesh,9381002802,madanapalle03.andhrapradesh@lenskartstore.com,11:00 AM,09:00 PM,4.9,1498,517325
2152,Vedayapalam,"D No 26-2, Survey No 1940, Plot No 55, Chaitanyapuri, Vedayapalem, Revenue Ward No 26 II, Nellore, Andhra Pradesh, 524004",Andhra Pradesh,8614018513,Nellorevedayapalem.tirupathi@lenskartstore.in,10:30 AM,09:30 PM,4.9,417,524004
2155,Mahanadu Road,"H No 52-1/1-1B, Ground Floor, Veternory Colony, NH 5 Service Road, Revenue Ward 2, Mahanadu Road, Vijayawada, Andhra Pradesh, 520008",Andhra Pradesh,8951052763,Mahanaduroad.vijayawada@lenskartstore.com,10:30 AM,09:30 PM,4.9,180,520008
878,Ongole,"Dno 5-417, Kurnool Road, Kurnool Road, Opposite Chimakurthy Eye Hospital, Ongole, Andhra Pradesh, 523001",Andhra Pradesh,9110362425,ongole.andhrapradesh@lenskartstore.com,11:00 AM,09:00 PM,4.9,1697,523001
123,"Sector 6, MVP Colony","2/30/26/1, Jami Function Hall, Sector 6, Mvp Colony, Near Mg Cancer Hospital, Visakhapatnam, Andhra Pradesh, 530017",Andhra Pradesh,7416582999,Mvpcokony.vizag@dealskart.mobi,11:00 AM,09:00 PM,4.8,1148,530017
139,Lakshmipuram,"H No 8/7 & 8/8, Anand Nilayam, Main Road, Lakshmipuram, Near Ntr Municipal Stadium, Guntur, Andhra Pradesh, 522007",Andhra Pradesh,7680959118,guntur.ap@lenskart.mobi,11:00 AM,09:30 PM,4.8,1889,522007
909,Daba Gardens,"Shop No G1, Door No 30-15-158, City Plaza, Daba Gardens, Opposite Sharma Sports, Visakhapatnam, Andhra Pradesh, 530020",Andhra Pradesh,8143803817,dabagarden.vizag@lenskartstore.com,11:00 AM,09:30 PM,4.9,1647,530020
1424,Kavali,"D No 10-15-35, Abm Compound Area, Kavali Bit 2, Shop No G-21 & F-21, Survey Number 1080/3-1, 1080/2, Kavali, Kavali, Andhra Pradesh, 524201",Andhra Pradesh,9885991298,Kavali.andhrapradesh@lenskartstore.com,11:00 AM,09:00 PM,4.9,939,524201
1434,Rajahmundry,"46-7-33, Danavipeta, Danavipeta, Rajahmundry, Andhra Pradesh, 533103",Andhra Pradesh,7396661451,Danavipet.rajahmundry@lenskartstore.com,11:00 AM,09:30 PM,4.9,2139,533103
1182,Kadapa,"Ground Floor, PP Sri Chaitanya School, Rajiv Park Road, Next To More Super Market, Kadapa, Andhra Pradesh, 516001",Andhra Pradesh,6305892292,kadapa.andhrapradesh@lenskartstore.com,11:00 AM,09:00 PM,4.9,2459,516001
678,Dargamitta,"No 24-3-186, Grand Truck Road, Dargamitta, Near Kims Hospital, Nellore, Andhra Pradesh, 524003",Andhra Pradesh,9346620093,sriaarushimarketin.nellore@lenskartstore.com,11:00 AM,09:00 PM,4.8,975,524003
2214,Ramavarapadu,"D.No 10-157, Tankasala Vari Centre, Beside HDFC Bank, Enikepadu Complex, Ramavarapadu, Vijayawada, Andhra Pradesh, 521108",Andhra Pradesh,8664066825,Vijayawada.ramvarupadu@lenskartstore.com,10:30 AM,09:30 PM,5.0,57,521108
167,"RTC Bus Stand Road, Anantapur","13-3-338 B, Ground Floor, Amar Inn Lodge, Bus Stand Road2, Srinivas Nagar, Anantapur, Andhra Pradesh, 515001",Andhra Pradesh,8554292260,anantpurbs.anantpur@lenskartstore.com,11:00 AM,09:00 PM,4.9,2144,515001
1196,Vijayawada,"H No 76-8-5/3, Survey No 66/1, Plot No 4, Bhavanipuram, Crombay Road No 1, Bhagatsingh Road, Vijayawada Town, Vijayawada Municipal Corporation, Bhavanipuram, Vijayawada, Andhra Pradesh, 520003",Andhra Pradesh,8522888242,Bhavanipuram.vijaywada@lenskartstore.com,10:30 AM,09:30 PM,4.8,732,520003
697,Bhimavaram,"27-1-4, J P Road, West Godavari, Next To Srinivasa Hospital, Bhimavaram, Andhra Pradesh, 534202",Andhra Pradesh,9577799699,bhimavaram.andhrapradesh@lenskartstore.com,11:00 AM,09:00 PM,4.8,1320,534202
1484,Proddatur,"Door #8/702, Gandhi Road, Opposite Posinsa Compound, Proddatur, Andhra Pradesh, 516360",Andhra Pradesh,7386573911,proddatur01.andhrapradesh@lenskartstore.com,11:00 AM,09:00 PM,4.9,2432,516360
2253,Kurmannapalem,"Door No 31-27-66, Shop No 3, Ground Floor, Beside Indusind ATM, Kurmanna Palem, Revenue Ward 58, Visakhapatnam, Andhra Pradesh, 530046",Andhra Pradesh,8914423851,kurmannapalem16.visakhapatnam@lenskartstore.com,10:30 AM,09:30 PM,5.0,145,530046
718,Meghana Mall,"Shop No 46,15/29, Ground Floor, Meghana Mall, Dwarka Nagar, High Street, Near Diamond Park, Visakhapatnam, Andhra Pradesh, 530016",Andhra Pradesh,8019522948,dwarkanagar.visakhapatnam@lenskartstore.com,11:00 AM,09:30 PM,4.9,1997,530016
1230,Maddilapalem,"No 9-1-224/1, T S No 1036/2, Waltair Ward, Cbm Compound, Maddilapalem, Rama Talkies Road, Visakhapatnam, Andhra Pradesh, 530003",Andhra Pradesh,9030938595,maddilapalem.vizag@lenskartstore.com,11:00 AM,09:30 PM,4.9,3204,530003
981,Marripalem,"Door No 36-46-69/4, Kancharapalem Main Road, Marripalem, Near Rama Rao Hospital, Visakhapatnam, Andhra Pradesh, 530008",Andhra Pradesh,7780568634,marripalem.vizag@lenskartstore.com,11:00 AM,09:30 PM,5.0,2182,530008
982,Rajahmundry,"31-1-30, Janda Panja Road, Near Ajantha Hotel, Rajahmundry, Andhra Pradesh, 533101",Andhra Pradesh,8885343877,RAJAHMUNDRY.ANDHRAPRADESH@LENSKARTSTORE.COM,11:00 AM,09:00 PM,4.8,444,533101
2009,Sujathanagar,"7-183/1/1, Survey No 145/5, Opposite Reliance Smart Point, Ratnagiri Nagar Greater, Visakhapatnam, Andhra Pradesh, 530051",Andhra Pradesh,8977860503,Sujathanagar.visakhapatnam@lenskartstore.com,10:30 AM,09:30 PM,,,530051
2268,Gujjanagulla,"Door No 4-18-37/1, 7th line, Chandramouli Nagar, Beside Platinum Cinemas, Gujjanagulla, Guntur, Andhra Pradesh, 522007",Andhra Pradesh,8296410646,Gujjnagundaguntur.vijaywada@lenskartstore.com,09:30 AM,09:30 PM,4.9,17,522007
1252,Jagdamba Vizag,"Ground Floor, Venu Regency, Ram Nagar, Jagdamba, Maddilapalem, Visakhapatnam, Andhra Pradesh, 530003",Andhra Pradesh,9059017663,Jagadamba.vizag@lenskartstore.com,11:00 AM,09:30 PM,4.9,1772,530003
1765,Poranki Vijayawada,"1-262/1 Poranki Gram Sri Rama Complex, Panchayat, Tadigadapa Centre MG Road, Penamaliri Mandal, Kankipadu Sub Reg Area, Krishna District, Vijayawada, Andhra Pradesh 521137",Andhra Pradesh,8522888602,Vijayawada.poranki@lenskartstore.com,10:30 AM,09:30 PM,4.9,476,521137
999,Anakapalle,"12-1-22/5, 4 Road, Nehru Chowk, Next To Sbi Main Branch, Anakapalle, Andhra Pradesh, 531001",Andhra Pradesh,7799686827,anakapalli.andhrapradesh@lenskartstore.com,11:00 AM,09:00 PM,4.9,1172,531001
489,SRMT Mall,"Shop No 206, Ground Floor, Srmt Mall, Sarpavaram Junction, Lalitha Nagar, Besides Kamal Watch Co, Kakinada, Andhra Pradesh, 533005",Andhra Pradesh,8846794002,srmtmall.kakinada@lenskartstore.com,11:00 AM,09:30 PM,4.9,5802,533005
2284,MVP Double Road,"Ground Floor D No 1-83-47/1, New Venkojipalem, Revenue Ward 8, Srinivasa Plaza, MVP Double Road, MVP Colony, Visakhapatnam, Andhra Pradesh, 530017",Andhra Pradesh,8105325652,mvpdoubleroad.visakhapatnam@lenskartstore.com,11:00 AM,09:30 PM,,,530017
1518,Adoni,"1/54/17, Sri Ramnagar Colony, AAS College Road, Kurnool District, Adoni, Andhra Pradesh, 518301",Andhra Pradesh,8500778540,adoni02.andhrapradesh@lenskartstore.com,11:00 AM,09:00 PM,5.0,1857,518301
752,Eluru Road,"#27-1-58, Sathya Estate, Muddha Subbaiah Street, Governor Pet, Eluru Road, Near South India Shopping Mall, Vijayawada, Andhra Pradesh, 520002",Andhra Pradesh,8522888212,elururoad.vijaywada@lenskartstore.com,10:30 AM,09:30 PM,4.8,1333,520002
1274,TTD Road Nandyal,"25-695-10, Ttd Road, Srinivasa Nagar, Opposite V-Mart, Nandyal, Andhra Pradesh, 518501",Andhra Pradesh,7799622507,Nandyal.andhrapradesh@lenskartstore.com,11:00 AM,09:00 PM,4.9,2170,518501
2300,Test Store,Andmaan Nicobar,Andmaan nicobar,8810365729,test3@valyoo.in,10:00 AM,09:00 PM,,,1111111
1411,Naharlagun,"Sector A, Nh 415, Sector A, Near Blackberry Store, Naharlagun, Arunachal Pradesh, 791110",Arunachal Pradesh,8119075703,naharlagun.arunachalpradesh@lenskartstore.com,10:00 AM,09:30 PM,4.8,257,791110
1551,Baihata Chariali,"Ground Floor, Dag No 1939, Guwahati Road, Baihata Chariali, Assam, 781381",Assam,7099093705,baihatachariali.guwahati@lenskartstore.com,10:30 AM,09:00 PM,4.9,853,781381
1048,Dr. B Baruah Road,"Royal Arcade, Dr. B Barua Road, Ulubari, Guwahati, Assam, 781007",Assam,7099093703,drbbaruahroad.guwahati@lenskartstore.com,11:00 AM,09:00 PM,4.8,558,781007
1305,Lalganesh,"Ground Floor, Lokhra Road, Kalapahar, Next To Icici Kalapahar Branch, Guwahati, Assam, 781018",Assam,8472932038,lalganesh1.guwahati@lenskartstore.com,10:30 AM,09:00 PM,4.9,497,781018
795,Flagship Store Lachitnagar,"Ground Floor, Gs Road, South Sarania, Lachit Nagar, Ulubari, Near Ulubari Petrol Pump, Guwahati, Assam, 781007",Assam,8011909354,ulubari.guwahati@lenskartstore.com,11:00 AM,09:00 PM,4.7,441,781007
820,Rehabari,"Rishav Plaza, A K Azad Road, Rehabari, Beside Apollo Pharmacy, Guwahati, Assam, 781008",Assam,7099093702,rehabari.guwahati@lenskartstore.com,10:30 AM,09:00 PM,4.8,505,781008
1853,Tinsukia,"Rangagora Road, Near Ultra Lab, Tinsukia, Assam, 786125",Assam,9954871919,Tinsukia02.Assam@Lenskartstore.Com,10:00 AM,08:00 PM,4.8,251,786125
2116,Asian Palace,"Ground Floor, Asian Palace, GS Road, Ulubari Opposite People Store, Near LIC Office, Guwahati, Assam, 781007",Assam,3614062562,gsroadasianpalace.guwahati@lenskartstore.com,11:00 AM,09:00 PM,5.0,147,781007
1608,Dibrugarh,"Ground Floor, Mancotta Road, Mancotta Road, Near Thana Charali, Dibrugarh, Assam, 786001",Assam,7099093707,rkbpath1.dibrugarh@lenskartstore.com,10:30 AM,09:00 PM,4.8,445,786001
597,Silpukhuri,"Ground Floor, Gnb Road, Silpukhuri, Kamrup Metropolition, Silpukhuri, Near Lakshmi Service Station, Guwahati, Assam, 781003",Assam,9127455475,silpukhuri.guwahati@lenskartstore.com,10:30 AM,09:00 PM,4.6,380,781003
855,Zoo Road,"R G Baruah Road, Spanish Garden, Opposite State Zoo, Spanish Garden, Beside Indian Petrol Pump, Guwahati, Assam, 781003",Assam,9707827462,zooroad.guwahati@lenskartstore.com,10:30 AM,09:00 PM,4.9,600,781003
2137,Tezpur,"Ground Floor, Hotel Central Point, Opposite Tezpur Police Station, Tezpur, Assam, 784001",Assam,3712352869,civilhospitalroad.tezpur@lenskartstore.com,11:00 AM,09:00 PM,4.9,162,784001
1627,Maligaon Chariali,"Gate No 1, Maligaon Chariali, Guwahati, Assam, 781011",Assam,3614085962,guwahati.maligaon@lenskartstore.com,10:30 AM,09:00 PM,4.7,268,781011
1894,Chapaguri,"Ground Floor, Chapaguri Road, Opposite Hotel Jahnabee Regency, North Bongaigaon, Amguri, Bongaigaon, Assam, 783380",Assam,7099093712,chapaguri.bongaigaon@lenskartstore.com,10:00 AM,09:00 PM,,,783380
2154,Central Mall,"Shop No 103, Ground Floor, Central Mall, Christian Basti, G S Road, Guwahati, Assam, 781005",Assam,7099020667,centralmall.guwahati@lenskartstore.com,11:00 AM,09:00 PM,4.9,183,781005
109,Marwaripatty,"Tripal House, At Road, Marwaripatty, Near Indian Oil Petrol Pump, Nagaon, Assam, 782001",Assam,6001256491,nagaon.assam@dealskart.mobi,10:00 AM,08:30 PM,4.8,637,782001
1412,Bamunimaidan,"Ground Floor, Girish Mansion, Maniram Dewan Road, Bamunimaidan, Beside Reliance Trends, Guwahati, Assam, 781021",Assam,8011751492,bamunimaidan.guwahati@lenskartstore.com,11:00 AM,09:00 PM,4.9,540,781021
1693,Rangia,"Ground Floor & Upper Floor, Rangia Town, Mouza Panduri , P S Rangia Under Rangia Revenue Circle, District Kamrup, Guwahati, Assam, 781354",Assam,7099093710,rangia.guwahati@lenskartstore.com,10:30 AM,09:00 PM,4.9,289,781354
1453,Silchar,"N S Avenue, Silchar, Ranghirkhari, Opposite Life Line Hospital, Silchar, Assam, 788005",Assam,9435426767,Silchar.assam02@lenskartstore.com,10:30 AM,09:00 PM,4.6,438,788005
1206,NCS Adabari,"Ground Floor, Ncs Square Mall, Adabari, P O & P S Bolpur, Adabari, Guwahati, Assam, 781014",Assam,7099093704,adabarincsmall.guwahati@lenskartstore.com,10:30 AM,09:00 PM,4.8,855,781014
2234,Duliajan,"16 No Tiniali, Duliajan, Duliajan Oil Town, Dibrugarh, Assam, 786602",Assam,6002267414,duliajannsea.dibrugarh@lenskartstore.com,11:00 AM,09:00 PM,4.7,72,786602
2251,AT Road Sivasagar,"Ward No 13, Station Chariali, AT Road, Sivasagar, Assam, 785640",Assam,8761073521,atroad.sivsagar@lenskartstore.com,11:00 AM,09:00 PM,4.9,78,785640
1749,Nalbari,"Ground Floor Rouchand Complex, Ward No 8, Barama Road, Opposite DC Office, Nalbari, Assam, 781335",Assam,3624350010,nalbari.guwahati@lenskartstore.com,11:00 AM,09:00 PM,4.9,459,781335
1242,Jorhat,"Gar-Ali, Jorhat, Gar-Ali, Opposite Gar Ali Masjid, Jorhat, Assam, 785001",Assam,9387780977,jorhat.assam@lenskartstore.com,10:30 AM,09:00 PM,4.8,539,785001
496,City Centre Mall,"Shop No Ff28, First Floor, City Centre Mall, Christian Basti, Guwahati, Assam, 781005",Assam,7099093706,citycenter.guwahati@lenskartstore.com,11:00 AM,09:00 PM,4.6,576,781005
1022,Hatigaon,"Ground Floor, House No 13, Uttam Marriage Hall, Hatigaon, Hatigaon, Near Bpcl Petrol Pump, Guwahati, Assam, 781038",Assam,8453826227,hatigaon.guwahati@lenskartstore.com,11:00 AM,09:00 PM,4.7,390,781038
160,Dispur,"Ground Floor, Ld Plaza, Gs Road, Dispur, Opposite Assam Secretariat, Guwahati, Assam, 781006",Assam,6901608447,LDplazza.guwahati@lenskartstore.com,10:30 AM,09:00 PM,4.3,440,781006
1450,Tezpur,"Style Bazar Building, Mahidhar Borah Road, Mahidhar Borah Road, Opposite Eidgah, Tezpur, Assam, 784001",Assam,6913143530,tezpur02.assam@lenskartstore.com,10:00 AM,08:30 PM,4.8,163,784001
1537,Khagaul Road,"Ground Floor, Khagaul Road, Anisabad, Opposite Mausam Vibhag, Patna, Bihar, 800002",Bihar,6124144511,khagaulroad.patna@lenskartstore.com,10:30 AM,08:30 PM,4.8,489,800002
2310,Gola Road,"Gola Road, Mouza Danapur, Near V Mart, Shehzadpur Bank Colony Road, Pargana Phulwari, Thana Danapur Sadar Registry, Patna, Bihar, 801503",Bihar,6124148097,golaroad.patna@lenskartstore.com,10:30 AM,08:30 PM,5.0,1,801503
1035,Ashok Rajpath,"Ground Floor, Ashok Rajpath, Near Pmch Gate Number 2, Ashok Rajpath, Opposite Bihar Youth Men'S Institute, Patna, Bihar, 800004",Bihar,6124144509,ashokrajpath.patna@lenskartstore.com,10:30 AM,08:30 PM,4.6,773,800004
1805,Jamui,"Ground Floor, AAS Hotal, kachari Road, Jamui, Bihar, 811307",Bihar,6345222028,amui02.bihar@lenskartstore.com,10:30 AM,08:30 PM,4.9,299,811307
1038,Bettiah,"Banuchapar, N H 28, Supriya Cinema Road, West Champaran, Near St. Joseph School, Bettiah, Bihar, 845438",Bihar,9934025050,bettiah.bihar@lenskartstore.com,10:00 AM,08:00 PM,4.8,677,845438
1041,Kurji Road,"Circle 247B, Holding 817A/2, Patliputra Circle, Ward 22B, Kurji Road, Kurji Road, Opposite Rbi Quarter, Patna, Bihar, 800010",Bihar,6124143439,KURJIROAD.PATNA@LENSKART.COM,10:30 AM,08:30 PM,4.9,1094,800010
38,West Boring Canal Road,"Shop No 22, Jagdish Lok Apartment, , West Boring Canal Road, Near Harilal'S Sweets, Patna, Bihar, 800001",Bihar,9835304449,nsoenterprises.patna@lenskart.mobi,11:00 AM,09:00 PM,4.6,953,800001
1336,Samastipur,"Main Road, Mohanpur, Mohanpur, Near Reliance Trends, Samastipur, Bihar, 848101",Bihar,8340407304,samastipur.bihar@lenskartstore.com,10:00 AM,08:00 PM,4.9,726,848101
59,Dakbunglow Road,"Shop No 143, Ground Floor, Block C, Mauryalok Complex, Dak Bunglow Road, Near Police Station Kotwali, Patna, Bihar, 800001",Bihar,9905088853,mauryalok.patna@lenskart.mobi,10:30 AM,09:00 PM,4.8,1069,800001
1097,Laheriasarai,"Laheriasarai Tower, Vip Road , Laheriasarai, Opposite Petrol Pump, Darbhanga, Bihar, 846001",Bihar,8864026032,laheriasarai.bihar@lenskartstore.com,10:30 AM,09:00 PM,4.9,762,846001
85,Kankarbagh,"Sn 4, Moti Mansion Apartment, Road No 2, Pc Colony, Kankarbagh, Opposite Apollo Trauma Centre, Patna, Bihar, 800020",Bihar,6122356488,kankarbagh.patna@lenskart.mobi,11:00 AM,09:00 PM,4.2,737,800020
1109,Ashiana,"Ground Floor, Khata No 708, Ashiana Digha Road, Near Passport Office , Beside Aditya Vision, Patna, Bihar, 800014",Bihar,6124001101,ashianaroad.patna@lenskartstore.com,10:30 AM,08:30 PM,4.8,700,800014
1121,Saguna More,"Saguna More, Khagaul Road, Front of Panache Banquet, Patna, Bihar, 801503",Bihar,6124060267,sagunamore.patna@lenskartstore.com,10:30 AM,08:30 PM,4.8,1029,801503
614,Gaya Bihar,"House No Gm001/1374, Ward No 22, Gb Road, Near Zila School, Gb Road, In Front Of Mvi Office, Gaya, Bihar, 823001",Bihar,6312950362,gayamainroad.bihar@lenskartstore.com,10:30 AM,08:30 PM,4.8,295,823001
886,Arrah,"Ground Floor, Krishn Kutri, Pakri, Katira More Road, Bhojpur, Arrah, Near Aditya Vision, Arrah, Bihar, 802301",Bihar,6299250100,arrah.bihar@lenskartstore.com,10:30 AM,09:00 PM,4.9,451,802301
893,Hajipur,"Khata No 476, Khesra No 693, Anwapur Chowk, Cinema Road, Hajipur, Bihar, 844101",Bihar,7004864745,hajipur.bihar@lenskartstore.com,10:00 AM,08:30 PM,4.9,815,844101
138,RN Shaw Chowk,"Hotel Holiday International, Shiv Shakti Enterprises, Rn Shaw Chowk, Opposite Roopbani Cinema, Purnia, Bihar, 854301",Bihar,8709504294,bihar.purnia@lenskartstore.com,10:30 AM,08:30 PM,4.5,292,854301
2187,Sampatchak,"Ground Floor, Gopalpur Thana, Near Reliance Trends, Sampatchak, Patna, Bihar, 800007",Bihar,8071290154,sampatchowk.patna@lenskartstore.com,10:00 AM,08:00 PM,4.9,72,800007
157,Nala Road,"R K Avenue, Nala Road, Near Durga Mandir, Patna, Bihar, 800004",Bihar,6207606797,nalaroad.patna@lenskartstore.com,11:00 AM,09:00 PM,4.7,461,800004
1187,Rajeev Nagar,"Shyam Smirti Enclave, Rajeev Nagar, Near V Mart, Patna, Bihar, 800024",Bihar,6124001198,rajeevnagar.patna@lenskartstore.com,10:30 AM,08:30 PM,4.9,463,800024
165,Raja Bazar,"Shop No 4, Ground Floor, Rk Estate, Pillar 62, Raja Bazar, Opposite Igims, Patna, Bihar, 800014",Bihar,6123171903,rajabazar.patna@lenskartstore.com,10:30 AM,09:00 PM,4.7,603,800014
688,Motihari,"Bank Road, Chhatauni, Mega Mall, Rajendra Nagar, Motihari, Chhatauni, In Front Of Rehman Hospital, Champaran, Bihar, 845401",Bihar,6252296222,motihari.bihar@lenskartstore.com,10:00 AM,08:00 PM,4.9,1091,845401
183,"Club Road, Muzaffarpur","Savita Complex, Mithanpura, Club Road, Ramna, Mithanpura, Opposite Mddm College, Muzaffarpur, Bihar, 842002",Bihar,8544636991,clubroad.muzaffarpur@lenskartstore.com,10:30 AM,08:30 PM,4.8,901,842002
1467,Buxar,"Main Road Chowk, Thatheri Bazar, Near Reliance Trends, Buxar, Bihar, 802101",Bihar,6203252945,buxar.bihar@lenskartstore.com,10:30 AM,08:30 PM,4.9,788,802101
197,Khaliphabag Chowk,"Shop No G5, Anshi Series City Complex, , Khaliphabag Chowk, Near Police Station Kotwali, Bhagalpur, Bihar, 812001",Bihar,8544636992,drpr.bhagalpur@lenskartstore.com,10:30 AM,08:30 PM,4.9,1552,812001
1487,Anisabad,"Sumaya Residency, Ground Floor, Shop Bearing Nos G2 And G3, Khagaul Road, Phulwarisharif, Near Mahavir Institute And Research Centre, Patna, Bihar, 801505",Bihar,6124073423,anisabad02.bihar@lenskartstore.com,10:30 AM,08:30 PM,4.9,359,801505
1491,Aurangabad,"Mg Road, Near Bank Of India, Mg Road, Aurangabad, Bihar, 824101",Bihar,6186469041,aurangabad01.bihar@lenskartstore.com,10:30 AM,08:30 PM,4.9,452,824101
2273,Phulwarisharif,"Ground Floor, Opposite Citycart, Golamber, Phulwarisharif, Patna, Bihar, 801505",Bihar,6124148098,phulwarisharif.patna@lenskartstore.com,10:30 AM,08:30 PM,4.9,90,801505
505,Mirzapur,"Ward No 20, Lalbagh, Mirzapur, Near Poonam Cinema, Darbhanga, Bihar, 846004",Bihar,6272355487,Mirzapur.darbhanga@lenskartstore.com,10:00 AM,08:00 PM,4.9,487,846004
2311,Panchkula,"Ground Floor, SCO 57, Swastik Vihar, MDC 5, Sector 5, Panchkula, Chandigarh, 160101",Chandigarh,1724682428,mdc5.panchkula@lenskartstore.com,11:00 AM,09:00 PM,,,160101
1549,Sector 22C,"Shop No 39, Sector 22C, Sector 22C, Near Aroma Hotel, Chandigarh, Punjab, 160022",Punjab,9818428429,sector22.chandigarh@lenskartstore.com,11:00 AM,09:30 PM,4.8,140,160022
1087,Sector 7C,"Sco38, Inner Market, Sector 7C, Chandigarh, Near Punjab And Sindh Bank, Chandigarh, Punjab, 160019",Punjab,1724124272,sector7c.chandigarh@lenskartstore.com,11:00 AM,09:00 PM,4.8,134,160019
1103,Sector 40C,"Sco 94, Basement & Ground Floor, Sector 40C, Chandigarh, Punjab, 160036",Punjab,1724122861,sector40.chandigarh@lenskartstore.com,11:00 AM,09:30 PM,4.6,196,160036
1425,Sector 47D,"Sco 45, Ground Floor, Sector 47D, Hdfc Bank, Chandigarh, Punjab, 160047",Punjab,1725096889,sector47.chandigarh@lenskartstore.com,11:00 AM,09:00 PM,4.7,263,160047
1171,"Sector 35C, Chandigarh","Grond Floor, Sector 35 C, Sco 407-408, Chandigarh, Punjab, 160035",Punjab,1724118557,Sector35cnew.chandigarh@lenskartstore.com,11:00 AM,09:30 PM,4.7,489,160035
931,"Sector 19C, Chandigarh","Sco 22, Sector 19C, Sector 19C, Near Palika Bazar, Chandigarh, Punjab, 160019",Punjab,1724001144,sco22.chandigarh@lenskartstore.com,11:00 AM,09:30 PM,4.8,676,160019
950,Sector 15C,"Sco 22, Sector 15-C, Sector 15C, Chandigarh, Punjab, 160015",Punjab,1724000500,sector15c.chandigarh@lenskartstore.com,11:00 AM,09:30 PM,4.8,501,160015
230,Elante Mall,"Shop No 228 A, 2Nd Floor, Unit No 1, Industrial Area, Elante Mall, Chandigarh, Punjab, 160002",Punjab,1724038339,elante.chandigarh@lenskart.mobi,11:00 AM,09:30 PM,4.5,514,160002
769,Mudichur,"No 20, Rathana Complex, Sri Ram Nagar, Mudichur Road, Tambaram West, Mudichur, Next To More Supre Market, Chennai, Tamil Nadu, 600045",Tamil Nadu,4443583148,mudichur.chennai@lenskartstore.com,11:00 AM,09:30 PM,4.9,1175,600045
